item_id,csv_row_number,question,expected_keys_json,status,error,question_dir,ground_truth_table_csv
row_336,336,"In Non-Small Cell Lung trials, convert 'Type of therapy' into is_combination = true/false.","[""is_combination""]",ok,,questions/is_combination__row_336__In_Non_Small_Cell_Lung_trials_convert_Type_of_therapy_into_is_combination_true_false,questions/is_combination__row_336__In_Non_Small_Cell_Lung_trials_convert_Type_of_therapy_into_is_combination_true_false/ground_truth_table.csv
row_338,338,"In Mesothelioma trials, classify the ICI by target class from its generic name as PD-1, PD-L1, or CTLA-4.","[""class""]",ok,,questions/class__row_338__In_Mesothelioma_trials_classify_the_ICI_by_target_class_from_its_generic_name_as_PD_1_PD_L,questions/class__row_338__In_Mesothelioma_trials_classify_the_ICI_by_target_class_from_its_generic_name_as_PD_1_PD_L/ground_truth_table.csv
row_339,339,"In Esophageal/GEJ trials, determine whether the listed endpoint is primary or secondary based on the endpoint text.","[""endpoint_role""]",ok,,questions/endpoint_role__row_339__In_Esophageal_GEJ_trials_determine_whether_the_listed_endpoint_is_primary_or_secondary_bas,questions/endpoint_role__row_339__In_Esophageal_GEJ_trials_determine_whether_the_listed_endpoint_is_primary_or_secondary_bas/ground_truth_table.csv
row_340,340,"For Atezolizumab trials in Non-Small Cell Lung, extract the trial acronym from the trial name (e.g., KEYNOTE-xxx, CHECKMATE-xxx).","[""trial_acronym""]",ok,,questions/trial_acronym__row_340__For_Atezolizumab_trials_in_Non_Small_Cell_Lung_extract_the_trial_acronym_from_the_trial_na,questions/trial_acronym__row_340__For_Atezolizumab_trials_in_Non_Small_Cell_Lung_extract_the_trial_acronym_from_the_trial_na/ground_truth_table.csv
row_342,342,"For Pembrolizumab trials in NSCLC, extract the trial acronym from the trial name (e.g., KEYNOTE-xxx, CHECKMATE-xxx).","[""trial_acronym""]",ok,,questions/trial_acronym__row_342__For_Pembrolizumab_trials_in_NSCLC_extract_the_trial_acronym_from_the_trial_name_e_g_KEYNOT,questions/trial_acronym__row_342__For_Pembrolizumab_trials_in_NSCLC_extract_the_trial_acronym_from_the_trial_name_e_g_KEYNOT/ground_truth_table.csv
row_343,343,"In Small Cell Lung trials, convert 'Type of therapy' into is_combination = true/false.","[""is_combination""]",ok,,questions/is_combination__row_343__In_Small_Cell_Lung_trials_convert_Type_of_therapy_into_is_combination_true_false,questions/is_combination__row_343__In_Small_Cell_Lung_trials_convert_Type_of_therapy_into_is_combination_true_false/ground_truth_table.csv
row_346,346,"In NSCLC trials, from the secondary endpoint text flag if immune-related adverse events (irAEs) were explicitly assessed.","[""irAE_assessed""]",ok,,questions/irAE_assessed__row_346__In_NSCLC_trials_from_the_secondary_endpoint_text_flag_if_immune_related_adverse_events_irA,questions/irAE_assessed__row_346__In_NSCLC_trials_from_the_secondary_endpoint_text_flag_if_immune_related_adverse_events_irA/ground_truth_table.csv
row_347,347,"In Non-Small Cell Lung Phase 3 trials, classify the control arm as active, placebo, or best supportive care.","[""control_category""]",ok,,questions/control_category__row_347__In_Non_Small_Cell_Lung_Phase_3_trials_classify_the_control_arm_as_active_placebo_or_best_s,questions/control_category__row_347__In_Non_Small_Cell_Lung_Phase_3_trials_classify_the_control_arm_as_active_placebo_or_best_s/ground_truth_table.csv
row_349,349,"In Esophageal/GEJ trials, categorize number of arms as 1-arm, 2-arm, or ≥3-arm.","[""arm_category""]",ok,,questions/arm_category__row_349__In_Esophageal_GEJ_trials_categorize_number_of_arms_as_1_arm_2_arm_or_3_arm,questions/arm_category__row_349__In_Esophageal_GEJ_trials_categorize_number_of_arms_as_1_arm_2_arm_or_3_arm/ground_truth_table.csv
row_350,350,"For Atezolizumab trials, bucket total sample size as small(<100), medium(100–299), or large(≥300).","[""size_bucket""]",ok,,questions/size_bucket__row_350__For_Atezolizumab_trials_bucket_total_sample_size_as_small_100_medium_100_299_or_large_300,questions/size_bucket__row_350__For_Atezolizumab_trials_bucket_total_sample_size_as_small_100_medium_100_299_or_large_300/ground_truth_table.csv
row_353,353,"In Pancreatic studies using ICI+TKI, list the TKI agent(s) mentioned in the treatment regimen.","[""tki_agents""]",ok,,questions/tki_agents__row_353__In_Pancreatic_studies_using_ICI_TKI_list_the_TKI_agent_s_mentioned_in_the_treatment_regime,questions/tki_agents__row_353__In_Pancreatic_studies_using_ICI_TKI_list_the_TKI_agent_s_mentioned_in_the_treatment_regime/ground_truth_table.csv
row_356,356,"For Tremelimumab trials in Non-Small Cell Lung, extract the trial acronym from the trial name (e.g., KEYNOTE-xxx, CHECKMATE-xxx).","[""trial_acronym""]",ok,,questions/trial_acronym__row_356__For_Tremelimumab_trials_in_Non_Small_Cell_Lung_extract_the_trial_acronym_from_the_trial_na,questions/trial_acronym__row_356__For_Tremelimumab_trials_in_Non_Small_Cell_Lung_extract_the_trial_acronym_from_the_trial_na/ground_truth_table.csv
row_357,357,"For Atezolizumab+Trastuzumab emtansine+Placebo trials, bucket trial phase into early (1/1b/2) vs late (3/4).","[""phase_bucket""]",ok,,questions/phase_bucket__row_357__For_Atezolizumab_Trastuzumab_emtansine_Placebo_trials_bucket_trial_phase_into_early_1_1b_2,questions/phase_bucket__row_357__For_Atezolizumab_Trastuzumab_emtansine_Placebo_trials_bucket_trial_phase_into_early_1_1b_2/ground_truth_table.csv
row_360,360,"For Tremelimumab trials in Renal cell, extract the trial acronym from the trial name (e.g., KEYNOTE-xxx, CHECKMATE-xxx).","[""trial_acronym""]",ok,,questions/trial_acronym__row_360__For_Tremelimumab_trials_in_Renal_cell_extract_the_trial_acronym_from_the_trial_name_e_g_KE,questions/trial_acronym__row_360__For_Tremelimumab_trials_in_Renal_cell_extract_the_trial_acronym_from_the_trial_name_e_g_KE/ground_truth_table.csv
row_362,362,"In Head and Neck trials, determine whether the listed endpoint is primary or secondary based on the endpoint text.","[""endpoint_role""]",ok,,questions/endpoint_role__row_362__In_Head_and_Neck_trials_determine_whether_the_listed_endpoint_is_primary_or_secondary_base,questions/endpoint_role__row_362__In_Head_and_Neck_trials_determine_whether_the_listed_endpoint_is_primary_or_secondary_base/ground_truth_table.csv
row_363,363,"In Breast trials with PD-L1 agents included in the meta-analysis, map the generic ICI name to its brand name.","[""brand_name""]",ok,,questions/brand_name__row_363__In_Breast_trials_with_PD_L1_agents_included_in_the_meta_analysis_map_the_generic_ICI_name,questions/brand_name__row_363__In_Breast_trials_with_PD_L1_agents_included_in_the_meta_analysis_map_the_generic_ICI_name/ground_truth_table.csv
row_364,364,"In Pancreatic trials, classify the ICI by target class from its generic name as PD-1, PD-L1, or CTLA-4.","[""class""]",ok,,questions/class__row_364__In_Pancreatic_trials_classify_the_ICI_by_target_class_from_its_generic_name_as_PD_1_PD_L1,questions/class__row_364__In_Pancreatic_trials_classify_the_ICI_by_target_class_from_its_generic_name_as_PD_1_PD_L1/ground_truth_table.csv
row_365,365,"For Durvalumab, Tremelimumab combination therapy trials, list additional agents in the treatment regimen beyond the ICI.","[""added_agents""]",ok,,questions/added_agents__row_365__For_Durvalumab_Tremelimumab_combination_therapy_trials_list_additional_agents_in_the_treat,questions/added_agents__row_365__For_Durvalumab_Tremelimumab_combination_therapy_trials_list_additional_agents_in_the_treat/ground_truth_table.csv
row_366,366,"In Hodgkin Lymphoma combination therapy trials, normalize the combination type to standardized labels (e.g., ICI+Chemo, ICI+TKI, ICI+ICI).","[""combo_type_norm""]",ok,,questions/combo_type_norm__row_366__In_Hodgkin_Lymphoma_combination_therapy_trials_normalize_the_combination_type_to_standardi,questions/combo_type_norm__row_366__In_Hodgkin_Lymphoma_combination_therapy_trials_normalize_the_combination_type_to_standardi/ground_truth_table.csv
row_367,367,"For Atezolizumab+Trastuzumab emtansine+Placebo combination therapy trials, list additional agents in the treatment regimen beyond the ICI.","[""added_agents""]",ok,,questions/added_agents__row_367__For_Atezolizumab_Trastuzumab_emtansine_Placebo_combination_therapy_trials_list_additional,questions/added_agents__row_367__For_Atezolizumab_Trastuzumab_emtansine_Placebo_combination_therapy_trials_list_additional/ground_truth_table.csv
row_368,368,"For Nivolumab, Ipilimumab trials, bucket the publication year into: ≤2014, 2015–2018, ≥2019.","[""era""]",ok,,questions/era__row_368__For_Nivolumab_Ipilimumab_trials_bucket_the_publication_year_into_2014_2015_2018_2019,questions/era__row_368__For_Nivolumab_Ipilimumab_trials_bucket_the_publication_year_into_2014_2015_2018_2019/ground_truth_table.csv
row_369,369,"In Urothelial trials with chemotherapy control, list the specific cytotoxic drugs from the control regimen.","[""control_drugs""]",ok,,questions/control_drugs__row_369__In_Urothelial_trials_with_chemotherapy_control_list_the_specific_cytotoxic_drugs_from_the,questions/control_drugs__row_369__In_Urothelial_trials_with_chemotherapy_control_list_the_specific_cytotoxic_drugs_from_the/ground_truth_table.csv
row_370,370,"For Atezolizumab+Trastuzumab emtansine+Placebo trials in Hodgkin Lymphoma, extract the trial acronym from the trial name (e.g., KEYNOTE-xxx, CHECKMATE-xxx).","[""trial_acronym""]",ok,,questions/trial_acronym__row_370__For_Atezolizumab_Trastuzumab_emtansine_Placebo_trials_in_Hodgkin_Lymphoma_extract_the_tria,questions/trial_acronym__row_370__For_Atezolizumab_Trastuzumab_emtansine_Placebo_trials_in_Hodgkin_Lymphoma_extract_the_tria/ground_truth_table.csv
row_371,371,"In Small Cell Lung trials, classify overall follow-up maturity: 'mature' if ≥24 months, else 'immature' (or 'unknown' if missing).","[""maturity""]",ok,,questions/maturity__row_371__In_Small_Cell_Lung_trials_classify_overall_follow_up_maturity_mature_if_24_months_else_imm,questions/maturity__row_371__In_Small_Cell_Lung_trials_classify_overall_follow_up_maturity_mature_if_24_months_else_imm/ground_truth_table.csv
row_372,372,"In Mesothelioma studies using ICI+TKI, list the TKI agent(s) mentioned in the treatment regimen.","[""tki_agents""]",ok,,questions/tki_agents__row_372__In_Mesothelioma_studies_using_ICI_TKI_list_the_TKI_agent_s_mentioned_in_the_treatment_regi,questions/tki_agents__row_372__In_Mesothelioma_studies_using_ICI_TKI_list_the_TKI_agent_s_mentioned_in_the_treatment_regi/ground_truth_table.csv
row_374,374,"In Pancreatic combination therapy trials, normalize the combination type to standardized labels (e.g., ICI+Chemo, ICI+TKI, ICI+ICI).","[""combo_type_norm""]",ok,,questions/combo_type_norm__row_374__In_Pancreatic_combination_therapy_trials_normalize_the_combination_type_to_standardized_la,questions/combo_type_norm__row_374__In_Pancreatic_combination_therapy_trials_normalize_the_combination_type_to_standardized_la/ground_truth_table.csv
row_375,375,"In Hodgkin Lymphoma Phase 3 trials, classify the control arm as active, placebo, or best supportive care.","[""control_category""]",ok,,questions/control_category__row_375__In_Hodgkin_Lymphoma_Phase_3_trials_classify_the_control_arm_as_active_placebo_or_best_supp,questions/control_category__row_375__In_Hodgkin_Lymphoma_Phase_3_trials_classify_the_control_arm_as_active_placebo_or_best_supp/ground_truth_table.csv
row_377,377,"In Urothelial trials with PD-L1 agents included in the meta-analysis, map the generic ICI name to its brand name.","[""brand_name""]",ok,,questions/brand_name__row_377__In_Urothelial_trials_with_PD_L1_agents_included_in_the_meta_analysis_map_the_generic_ICI_n,questions/brand_name__row_377__In_Urothelial_trials_with_PD_L1_agents_included_in_the_meta_analysis_map_the_generic_ICI_n/ground_truth_table.csv
row_379,379,"In Renal cell trials, convert 'Type of therapy' into is_combination = true/false.","[""is_combination""]",ok,,questions/is_combination__row_379__In_Renal_cell_trials_convert_Type_of_therapy_into_is_combination_true_false,questions/is_combination__row_379__In_Renal_cell_trials_convert_Type_of_therapy_into_is_combination_true_false/ground_truth_table.csv
row_380,380,"In Hepatocellular trials, classify the ICI by target class from its generic name as PD-1, PD-L1, or CTLA-4.","[""class""]",ok,,questions/class__row_380__In_Hepatocellular_trials_classify_the_ICI_by_target_class_from_its_generic_name_as_PD_1_PD,questions/class__row_380__In_Hepatocellular_trials_classify_the_ICI_by_target_class_from_its_generic_name_as_PD_1_PD/ground_truth_table.csv
row_381,381,"In Esophageal/GEJ trials with PD-L1 agents included in the meta-analysis, map the generic ICI name to its brand name.","[""brand_name""]",ok,,questions/brand_name__row_381__In_Esophageal_GEJ_trials_with_PD_L1_agents_included_in_the_meta_analysis_map_the_generic_I,questions/brand_name__row_381__In_Esophageal_GEJ_trials_with_PD_L1_agents_included_in_the_meta_analysis_map_the_generic_I/ground_truth_table.csv
row_383,383,"In Bladder trials, categorize number of arms as 1-arm, 2-arm, or ≥3-arm.","[""arm_category""]",ok,,questions/arm_category__row_383__In_Bladder_trials_categorize_number_of_arms_as_1_arm_2_arm_or_3_arm,questions/arm_category__row_383__In_Bladder_trials_categorize_number_of_arms_as_1_arm_2_arm_or_3_arm/ground_truth_table.csv
row_384,384,"In Head and Neck Phase 2 trials, standardize the primary endpoint into one of OS, PFS, ORR, DFS, DOR, AE-rate, or Other.","[""primary_endpoint_category""]",ok,,questions/primary_endpoint_category__row_384__In_Head_and_Neck_Phase_2_trials_standardize_the_primary_endpoint_into_one_of_OS_PFS_ORR_DF,questions/primary_endpoint_category__row_384__In_Head_and_Neck_Phase_2_trials_standardize_the_primary_endpoint_into_one_of_OS_PFS_ORR_DF/ground_truth_table.csv
row_385,385,"In Small Cell Lung combination therapy trials, normalize the combination type to standardized labels (e.g., ICI+Chemo, ICI+TKI, ICI+ICI).","[""combo_type_norm""]",ok,,questions/combo_type_norm__row_385__In_Small_Cell_Lung_combination_therapy_trials_normalize_the_combination_type_to_standardiz,questions/combo_type_norm__row_385__In_Small_Cell_Lung_combination_therapy_trials_normalize_the_combination_type_to_standardiz/ground_truth_table.csv
row_387,387,"In Head and Neck trials, interpret the PD-L1 requirement flag as boolean true/false.","[""pd_l1_required""]",ok,,questions/pd_l1_required__row_387__In_Head_and_Neck_trials_interpret_the_PD_L1_requirement_flag_as_boolean_true_false,questions/pd_l1_required__row_387__In_Head_and_Neck_trials_interpret_the_PD_L1_requirement_flag_as_boolean_true_false/ground_truth_table.csv
row_389,389,"In Bladder trials, convert 'Type of therapy' into is_combination = true/false.","[""is_combination""]",ok,,questions/is_combination__row_389__In_Bladder_trials_convert_Type_of_therapy_into_is_combination_true_false,questions/is_combination__row_389__In_Bladder_trials_convert_Type_of_therapy_into_is_combination_true_false/ground_truth_table.csv
row_390,390,"In Prostate trials, classify overall follow-up maturity: 'mature' if ≥24 months, else 'immature' (or 'unknown' if missing).","[""maturity""]",ok,,questions/maturity__row_390__In_Prostate_trials_classify_overall_follow_up_maturity_mature_if_24_months_else_immature_o,questions/maturity__row_390__In_Prostate_trials_classify_overall_follow_up_maturity_mature_if_24_months_else_immature_o/ground_truth_table.csv
row_391,391,"In Small Cell Lung Phase 3 trials, standardize the primary endpoint into one of OS, PFS, ORR, DFS, DOR, AE-rate, or Other.","[""primary_endpoint_category""]",ok,,questions/primary_endpoint_category__row_391__In_Small_Cell_Lung_Phase_3_trials_standardize_the_primary_endpoint_into_one_of_OS_PFS_ORR,questions/primary_endpoint_category__row_391__In_Small_Cell_Lung_Phase_3_trials_standardize_the_primary_endpoint_into_one_of_OS_PFS_ORR/ground_truth_table.csv
row_392,392,"For Pembrolizumab trials, bucket trial phase into early (1/1b/2) vs late (3/4).","[""phase_bucket""]",ok,,questions/phase_bucket__row_392__For_Pembrolizumab_trials_bucket_trial_phase_into_early_1_1b_2_vs_late_3_4,questions/phase_bucket__row_392__For_Pembrolizumab_trials_bucket_trial_phase_into_early_1_1b_2_vs_late_3_4/ground_truth_table.csv
row_393,393,"For Avelumab trials in Mesothelioma, extract the trial acronym from the trial name (e.g., KEYNOTE-xxx, CHECKMATE-xxx).","[""trial_acronym""]",ok,,questions/trial_acronym__row_393__For_Avelumab_trials_in_Mesothelioma_extract_the_trial_acronym_from_the_trial_name_e_g_KEYN,questions/trial_acronym__row_393__For_Avelumab_trials_in_Mesothelioma_extract_the_trial_acronym_from_the_trial_name_e_g_KEYN/ground_truth_table.csv
row_394,394,"In Head and Neck trials, convert 'Original/Follow up' status into a boolean is_follow_up.","[""is_follow_up""]",ok,,questions/is_follow_up__row_394__In_Head_and_Neck_trials_convert_Original_Follow_up_status_into_a_boolean_is_follow_up,questions/is_follow_up__row_394__In_Head_and_Neck_trials_convert_Original_Follow_up_status_into_a_boolean_is_follow_up/ground_truth_table.csv
row_395,395,"In Head and Neck trials, convert 'Type of therapy' into is_combination = true/false.","[""is_combination""]",ok,,questions/is_combination__row_395__In_Head_and_Neck_trials_convert_Type_of_therapy_into_is_combination_true_false,questions/is_combination__row_395__In_Head_and_Neck_trials_convert_Type_of_therapy_into_is_combination_true_false/ground_truth_table.csv
row_397,397,"In Mesothelioma trials with PD-L1 agents included in the meta-analysis, map the generic ICI name to its brand name.","[""brand_name""]",ok,,questions/brand_name__row_397__In_Mesothelioma_trials_with_PD_L1_agents_included_in_the_meta_analysis_map_the_generic_ICI,questions/brand_name__row_397__In_Mesothelioma_trials_with_PD_L1_agents_included_in_the_meta_analysis_map_the_generic_ICI/ground_truth_table.csv
row_398,398,"In Melanoma trials, classify the ICI by target class from its generic name as PD-1, PD-L1, or CTLA-4.","[""class""]",ok,,questions/class__row_398__In_Melanoma_trials_classify_the_ICI_by_target_class_from_its_generic_name_as_PD_1_PD_L1_or,questions/class__row_398__In_Melanoma_trials_classify_the_ICI_by_target_class_from_its_generic_name_as_PD_1_PD_L1_or/ground_truth_table.csv
row_399,399,"For Brentuximab-vedotin trials in Hodgkin Lymphoma, extract the trial acronym from the trial name (e.g., KEYNOTE-xxx, CHECKMATE-xxx).","[""trial_acronym""]",ok,,questions/trial_acronym__row_399__For_Brentuximab_vedotin_trials_in_Hodgkin_Lymphoma_extract_the_trial_acronym_from_the_tria,questions/trial_acronym__row_399__For_Brentuximab_vedotin_trials_in_Hodgkin_Lymphoma_extract_the_trial_acronym_from_the_tria/ground_truth_table.csv
row_400,400,"For Pembrolizumab trials, bucket the publication year into: ≤2014, 2015–2018, ≥2019.","[""era""]",ok,,questions/era__row_400__For_Pembrolizumab_trials_bucket_the_publication_year_into_2014_2015_2018_2019,questions/era__row_400__For_Pembrolizumab_trials_bucket_the_publication_year_into_2014_2015_2018_2019/ground_truth_table.csv
row_401,401,"In Multiple Myeloma studies using ICI+TKI, list the TKI agent(s) mentioned in the treatment regimen.","[""tki_agents""]",ok,,questions/tki_agents__row_401__In_Multiple_Myeloma_studies_using_ICI_TKI_list_the_TKI_agent_s_mentioned_in_the_treatment,questions/tki_agents__row_401__In_Multiple_Myeloma_studies_using_ICI_TKI_list_the_TKI_agent_s_mentioned_in_the_treatment/ground_truth_table.csv
row_402,402,"For Atezolizumab+Trastuzumab emtansine+Placebo trials in Mesothelioma, extract the trial acronym from the trial name (e.g., KEYNOTE-xxx, CHECKMATE-xxx).","[""trial_acronym""]",ok,,questions/trial_acronym__row_402__For_Atezolizumab_Trastuzumab_emtansine_Placebo_trials_in_Mesothelioma_extract_the_trial_ac,questions/trial_acronym__row_402__For_Atezolizumab_Trastuzumab_emtansine_Placebo_trials_in_Mesothelioma_extract_the_trial_ac/ground_truth_table.csv
row_403,403,"In Gastric/GEJ trials, convert 'Original/Follow up' status into a boolean is_follow_up.","[""is_follow_up""]",ok,,questions/is_follow_up__row_403__In_Gastric_GEJ_trials_convert_Original_Follow_up_status_into_a_boolean_is_follow_up,questions/is_follow_up__row_403__In_Gastric_GEJ_trials_convert_Original_Follow_up_status_into_a_boolean_is_follow_up/ground_truth_table.csv
row_404,404,"For Brentuximab-vedotin trials in Hepatocellular, extract the trial acronym from the trial name (e.g., KEYNOTE-xxx, CHECKMATE-xxx).","[""trial_acronym""]",ok,,questions/trial_acronym__row_404__For_Brentuximab_vedotin_trials_in_Hepatocellular_extract_the_trial_acronym_from_the_trial,questions/trial_acronym__row_404__For_Brentuximab_vedotin_trials_in_Hepatocellular_extract_the_trial_acronym_from_the_trial/ground_truth_table.csv
row_405,405,"For Chemotherapy trials, bucket the publication year into: ≤2014, 2015–2018, ≥2019.","[""era""]",ok,,questions/era__row_405__For_Chemotherapy_trials_bucket_the_publication_year_into_2014_2015_2018_2019,questions/era__row_405__For_Chemotherapy_trials_bucket_the_publication_year_into_2014_2015_2018_2019/ground_truth_table.csv
row_406,406,"For Durvalumab trials in Small Cell Lung, extract the trial acronym from the trial name (e.g., KEYNOTE-xxx, CHECKMATE-xxx).","[""trial_acronym""]",ok,,questions/trial_acronym__row_406__For_Durvalumab_trials_in_Small_Cell_Lung_extract_the_trial_acronym_from_the_trial_name_e_g,questions/trial_acronym__row_406__For_Durvalumab_trials_in_Small_Cell_Lung_extract_the_trial_acronym_from_the_trial_name_e_g/ground_truth_table.csv
row_407,407,"In Melanoma studies using ICI+TKI, list the TKI agent(s) mentioned in the treatment regimen.","[""tki_agents""]",ok,,questions/tki_agents__row_407__In_Melanoma_studies_using_ICI_TKI_list_the_TKI_agent_s_mentioned_in_the_treatment_regimen,questions/tki_agents__row_407__In_Melanoma_studies_using_ICI_TKI_list_the_TKI_agent_s_mentioned_in_the_treatment_regimen/ground_truth_table.csv
row_408,408,"In Bladder trials with PD-L1 agents included in the meta-analysis, map the generic ICI name to its brand name.","[""brand_name""]",ok,,questions/brand_name__row_408__In_Bladder_trials_with_PD_L1_agents_included_in_the_meta_analysis_map_the_generic_ICI_name,questions/brand_name__row_408__In_Bladder_trials_with_PD_L1_agents_included_in_the_meta_analysis_map_the_generic_ICI_name/ground_truth_table.csv
row_409,409,"In Small Cell Lung trials, interpret the PD-L1 requirement flag as boolean true/false.","[""pd_l1_required""]",ok,,questions/pd_l1_required__row_409__In_Small_Cell_Lung_trials_interpret_the_PD_L1_requirement_flag_as_boolean_true_false,questions/pd_l1_required__row_409__In_Small_Cell_Lung_trials_interpret_the_PD_L1_requirement_flag_as_boolean_true_false/ground_truth_table.csv
row_410,410,"For Avelumab trials in Urothelial, extract the trial acronym from the trial name (e.g., KEYNOTE-xxx, CHECKMATE-xxx).","[""trial_acronym""]",ok,,questions/trial_acronym__row_410__For_Avelumab_trials_in_Urothelial_extract_the_trial_acronym_from_the_trial_name_e_g_KEYNOT,questions/trial_acronym__row_410__For_Avelumab_trials_in_Urothelial_extract_the_trial_acronym_from_the_trial_name_e_g_KEYNOT/ground_truth_table.csv
row_411,411,"In Hodgkin Lymphoma Phase 3 trials, standardize the primary endpoint into one of OS, PFS, ORR, DFS, DOR, AE-rate, or Other.","[""primary_endpoint_category""]",ok,,questions/primary_endpoint_category__row_411__In_Hodgkin_Lymphoma_Phase_3_trials_standardize_the_primary_endpoint_into_one_of_OS_PFS_ORR,questions/primary_endpoint_category__row_411__In_Hodgkin_Lymphoma_Phase_3_trials_standardize_the_primary_endpoint_into_one_of_OS_PFS_ORR/ground_truth_table.csv
row_412,412,"In Pancreatic trials, convert 'Original/Follow up' status into a boolean is_follow_up.","[""is_follow_up""]",ok,,questions/is_follow_up__row_412__In_Pancreatic_trials_convert_Original_Follow_up_status_into_a_boolean_is_follow_up,questions/is_follow_up__row_412__In_Pancreatic_trials_convert_Original_Follow_up_status_into_a_boolean_is_follow_up/ground_truth_table.csv
row_414,414,"In Melanoma Phase 3 trials, standardize the primary endpoint into one of OS, PFS, ORR, DFS, DOR, AE-rate, or Other.","[""primary_endpoint_category""]",ok,,questions/primary_endpoint_category__row_414__In_Melanoma_Phase_3_trials_standardize_the_primary_endpoint_into_one_of_OS_PFS_ORR_DFS_DOR,questions/primary_endpoint_category__row_414__In_Melanoma_Phase_3_trials_standardize_the_primary_endpoint_into_one_of_OS_PFS_ORR_DFS_DOR/ground_truth_table.csv
row_415,415,"For Durvalumab, Tremelimumab trials, bucket trial phase into early (1/1b/2) vs late (3/4).","[""phase_bucket""]",ok,,questions/phase_bucket__row_415__For_Durvalumab_Tremelimumab_trials_bucket_trial_phase_into_early_1_1b_2_vs_late_3_4,questions/phase_bucket__row_415__For_Durvalumab_Tremelimumab_trials_bucket_trial_phase_into_early_1_1b_2_vs_late_3_4/ground_truth_table.csv
row_416,416,"In Hepatocellular trials with chemotherapy control, list the specific cytotoxic drugs from the control regimen.","[""control_drugs""]",ok,,questions/control_drugs__row_416__In_Hepatocellular_trials_with_chemotherapy_control_list_the_specific_cytotoxic_drugs_from,questions/control_drugs__row_416__In_Hepatocellular_trials_with_chemotherapy_control_list_the_specific_cytotoxic_drugs_from/ground_truth_table.csv
row_418,418,"In Hodgkin Lymphoma trials, determine whether the listed endpoint is primary or secondary based on the endpoint text.","[""endpoint_role""]",ok,,questions/endpoint_role__row_418__In_Hodgkin_Lymphoma_trials_determine_whether_the_listed_endpoint_is_primary_or_secondary_b,questions/endpoint_role__row_418__In_Hodgkin_Lymphoma_trials_determine_whether_the_listed_endpoint_is_primary_or_secondary_b/ground_truth_table.csv
