item_id,csv_row_number,question,expected_keys_json,status,error,question_dir,ground_truth_table_csv
row_84,84,"In Gastric/GEJ Phase 2 trials, standardize the primary endpoint into one of OS, PFS, ORR, DFS, DOR, AE-rate, or Other.","[""primary_endpoint_category""]",ok,,questions/primary_endpoint_category__row_84__In_Gastric_GEJ_Phase_2_trials_standardize_the_primary_endpoint_into_one_of_OS_PFS_ORR_DFS,questions/primary_endpoint_category__row_84__In_Gastric_GEJ_Phase_2_trials_standardize_the_primary_endpoint_into_one_of_OS_PFS_ORR_DFS/ground_truth_table.csv
row_85,85,"In Esophageal/GEJ trials with chemotherapy control, list the specific cytotoxic drugs from the control regimen.","[""control_drugs""]",ok,,questions/control_drugs__row_85__In_Esophageal_GEJ_trials_with_chemotherapy_control_list_the_specific_cytotoxic_drugs_from,questions/control_drugs__row_85__In_Esophageal_GEJ_trials_with_chemotherapy_control_list_the_specific_cytotoxic_drugs_from/ground_truth_table.csv
row_86,86,"In Esophageal/GEJ trials, classify overall follow-up maturity: 'mature' if ≥24 months, else 'immature' (or 'unknown' if missing).","[""maturity""]",ok,,questions/maturity__row_86__In_Esophageal_GEJ_trials_classify_overall_follow_up_maturity_mature_if_24_months_else_imma,questions/maturity__row_86__In_Esophageal_GEJ_trials_classify_overall_follow_up_maturity_mature_if_24_months_else_imma/ground_truth_table.csv
row_87,87,"In Head and Neck trials, normalize the clinical setting to one of: neoadjuvant, adjuvant, perioperative, metastatic/advanced.","[""setting_normalized""]",ok,,questions/setting_normalized__row_87__In_Head_and_Neck_trials_normalize_the_clinical_setting_to_one_of_neoadjuvant_adjuvant_peri,questions/setting_normalized__row_87__In_Head_and_Neck_trials_normalize_the_clinical_setting_to_one_of_neoadjuvant_adjuvant_peri/ground_truth_table.csv
row_88,88,"In Renal cell trials with PD-L1 agents included in the meta-analysis, map the generic ICI name to its brand name.","[""brand_name""]",ok,,questions/brand_name__row_88__In_Renal_cell_trials_with_PD_L1_agents_included_in_the_meta_analysis_map_the_generic_ICI_n,questions/brand_name__row_88__In_Renal_cell_trials_with_PD_L1_agents_included_in_the_meta_analysis_map_the_generic_ICI_n/ground_truth_table.csv
row_89,89,"For Tremelimumab trials, bucket trial phase into early (1/1b/2) vs late (3/4).","[""phase_bucket""]",ok,,questions/phase_bucket__row_89__For_Tremelimumab_trials_bucket_trial_phase_into_early_1_1b_2_vs_late_3_4,questions/phase_bucket__row_89__For_Tremelimumab_trials_bucket_trial_phase_into_early_1_1b_2_vs_late_3_4/ground_truth_table.csv
row_91,91,"In Gastric/GEJ trials with PD-L1 agents included in the meta-analysis, map the generic ICI name to its brand name.","[""brand_name""]",ok,,questions/brand_name__row_91__In_Gastric_GEJ_trials_with_PD_L1_agents_included_in_the_meta_analysis_map_the_generic_ICI,questions/brand_name__row_91__In_Gastric_GEJ_trials_with_PD_L1_agents_included_in_the_meta_analysis_map_the_generic_ICI/ground_truth_table.csv
row_92,92,"In Mesothelioma trials, convert 'Original/Follow up' status into a boolean is_follow_up.","[""is_follow_up""]",ok,,questions/is_follow_up__row_92__In_Mesothelioma_trials_convert_Original_Follow_up_status_into_a_boolean_is_follow_up,questions/is_follow_up__row_92__In_Mesothelioma_trials_convert_Original_Follow_up_status_into_a_boolean_is_follow_up/ground_truth_table.csv
row_93,93,"In NSCLC trials, convert 'Type of therapy' into is_combination = true/false.","[""is_combination""]",ok,,questions/is_combination__row_93__In_NSCLC_trials_convert_Type_of_therapy_into_is_combination_true_false,questions/is_combination__row_93__In_NSCLC_trials_convert_Type_of_therapy_into_is_combination_true_false/ground_truth_table.csv
row_94,94,"For Nivolumab, Ipilimumab trials, bucket total sample size as small(<100), medium(100–299), or large(≥300).","[""size_bucket""]",ok,,questions/size_bucket__row_94__For_Nivolumab_Ipilimumab_trials_bucket_total_sample_size_as_small_100_medium_100_299_or_la,questions/size_bucket__row_94__For_Nivolumab_Ipilimumab_trials_bucket_total_sample_size_as_small_100_medium_100_299_or_la/ground_truth_table.csv
row_95,95,"In Small Cell Lung trials with PD-L1 agents included in the meta-analysis, map the generic ICI name to its brand name.","[""brand_name""]",ok,,questions/brand_name__row_95__In_Small_Cell_Lung_trials_with_PD_L1_agents_included_in_the_meta_analysis_map_the_generic,questions/brand_name__row_95__In_Small_Cell_Lung_trials_with_PD_L1_agents_included_in_the_meta_analysis_map_the_generic/ground_truth_table.csv
row_96,96,"In Prostate combination therapy trials, normalize the combination type to standardized labels (e.g., ICI+Chemo, ICI+TKI, ICI+ICI).","[""combo_type_norm""]",ok,,questions/combo_type_norm__row_96__In_Prostate_combination_therapy_trials_normalize_the_combination_type_to_standardized_labe,questions/combo_type_norm__row_96__In_Prostate_combination_therapy_trials_normalize_the_combination_type_to_standardized_labe/ground_truth_table.csv
row_97,97,"For Nivolumab, Ipilimumab trials in Colorectal, extract the trial acronym from the trial name (e.g., KEYNOTE-xxx, CHECKMATE-xxx).","[""trial_acronym""]",ok,,questions/trial_acronym__row_97__For_Nivolumab_Ipilimumab_trials_in_Colorectal_extract_the_trial_acronym_from_the_trial_nam,questions/trial_acronym__row_97__For_Nivolumab_Ipilimumab_trials_in_Colorectal_extract_the_trial_acronym_from_the_trial_nam/ground_truth_table.csv
row_98,98,"In Mesothelioma trials with chemotherapy control, list the specific cytotoxic drugs from the control regimen.","[""control_drugs""]",ok,,questions/control_drugs__row_98__In_Mesothelioma_trials_with_chemotherapy_control_list_the_specific_cytotoxic_drugs_from_th,questions/control_drugs__row_98__In_Mesothelioma_trials_with_chemotherapy_control_list_the_specific_cytotoxic_drugs_from_th/ground_truth_table.csv
row_99,99,"In Breast trials, classify overall follow-up maturity: 'mature' if ≥24 months, else 'immature' (or 'unknown' if missing).","[""maturity""]",ok,,questions/maturity__row_99__In_Breast_trials_classify_overall_follow_up_maturity_mature_if_24_months_else_immature_or,questions/maturity__row_99__In_Breast_trials_classify_overall_follow_up_maturity_mature_if_24_months_else_immature_or/ground_truth_table.csv
row_100,100,"In Small Cell Lung trials with chemotherapy control, list the specific cytotoxic drugs from the control regimen.","[""control_drugs""]",ok,,questions/control_drugs__row_100__In_Small_Cell_Lung_trials_with_chemotherapy_control_list_the_specific_cytotoxic_drugs_from,questions/control_drugs__row_100__In_Small_Cell_Lung_trials_with_chemotherapy_control_list_the_specific_cytotoxic_drugs_from/ground_truth_table.csv
row_101,101,"In NSCLC Phase 3 trials, classify the control arm as active, placebo, or best supportive care.","[""control_category""]",ok,,questions/control_category__row_101__In_NSCLC_Phase_3_trials_classify_the_control_arm_as_active_placebo_or_best_supportive_care,questions/control_category__row_101__In_NSCLC_Phase_3_trials_classify_the_control_arm_as_active_placebo_or_best_supportive_care/ground_truth_table.csv
row_102,102,"In renal cell carcinoma studies using ICI+Anti-VEGF, list the specific anti-VEGF agent(s) from the treatment regimen.","[""anti_vegf_agents""]",ok,,questions/anti_vegf_agents__row_102__In_renal_cell_carcinoma_studies_using_ICI_Anti_VEGF_list_the_specific_anti_VEGF_agent_s_fr,questions/anti_vegf_agents__row_102__In_renal_cell_carcinoma_studies_using_ICI_Anti_VEGF_list_the_specific_anti_VEGF_agent_s_fr/ground_truth_table.csv
row_103,103,"In Gastric/GEJ Phase 3 trials, classify the control arm as active, placebo, or best supportive care.","[""control_category""]",ok,,questions/control_category__row_103__In_Gastric_GEJ_Phase_3_trials_classify_the_control_arm_as_active_placebo_or_best_supportiv,questions/control_category__row_103__In_Gastric_GEJ_Phase_3_trials_classify_the_control_arm_as_active_placebo_or_best_supportiv/ground_truth_table.csv
row_104,104,"In Renal cell trials, from the secondary endpoint text flag if immune-related adverse events (irAEs) were explicitly assessed.","[""irAE_assessed""]",ok,,questions/irAE_assessed__row_104__In_Renal_cell_trials_from_the_secondary_endpoint_text_flag_if_immune_related_adverse_event,questions/irAE_assessed__row_104__In_Renal_cell_trials_from_the_secondary_endpoint_text_flag_if_immune_related_adverse_event/ground_truth_table.csv
row_105,105,"In Pancreatic trials, determine whether the listed endpoint is primary or secondary based on the endpoint text.","[""endpoint_role""]",ok,,questions/endpoint_role__row_105__In_Pancreatic_trials_determine_whether_the_listed_endpoint_is_primary_or_secondary_based_o,questions/endpoint_role__row_105__In_Pancreatic_trials_determine_whether_the_listed_endpoint_is_primary_or_secondary_based_o/ground_truth_table.csv
row_106,106,"In Small Cell Lung trials, determine whether the listed endpoint is primary or secondary based on the endpoint text.","[""endpoint_role""]",ok,,questions/endpoint_role__row_106__In_Small_Cell_Lung_trials_determine_whether_the_listed_endpoint_is_primary_or_secondary_ba,questions/endpoint_role__row_106__In_Small_Cell_Lung_trials_determine_whether_the_listed_endpoint_is_primary_or_secondary_ba/ground_truth_table.csv
row_107,107,"For Atezolizumab trials, bucket trial phase into early (1/1b/2) vs late (3/4).","[""phase_bucket""]",ok,,questions/phase_bucket__row_107__For_Atezolizumab_trials_bucket_trial_phase_into_early_1_1b_2_vs_late_3_4,questions/phase_bucket__row_107__For_Atezolizumab_trials_bucket_trial_phase_into_early_1_1b_2_vs_late_3_4/ground_truth_table.csv
row_108,108,"For Chemotherapy trials, bucket total sample size as small(<100), medium(100–299), or large(≥300).","[""size_bucket""]",ok,,questions/size_bucket__row_108__For_Chemotherapy_trials_bucket_total_sample_size_as_small_100_medium_100_299_or_large_300,questions/size_bucket__row_108__For_Chemotherapy_trials_bucket_total_sample_size_as_small_100_medium_100_299_or_large_300/ground_truth_table.csv
row_110,110,"In Renal cell trials with chemotherapy control, list the specific cytotoxic drugs from the control regimen.","[""control_drugs""]",ok,,questions/control_drugs__row_110__In_Renal_cell_trials_with_chemotherapy_control_list_the_specific_cytotoxic_drugs_from_the,questions/control_drugs__row_110__In_Renal_cell_trials_with_chemotherapy_control_list_the_specific_cytotoxic_drugs_from_the/ground_truth_table.csv
row_111,111,"In Urothelial trials, convert 'Original/Follow up' status into a boolean is_follow_up.","[""is_follow_up""]",ok,,questions/is_follow_up__row_111__In_Urothelial_trials_convert_Original_Follow_up_status_into_a_boolean_is_follow_up,questions/is_follow_up__row_111__In_Urothelial_trials_convert_Original_Follow_up_status_into_a_boolean_is_follow_up/ground_truth_table.csv
row_114,114,"In Pancreatic trials with chemotherapy control, list the specific cytotoxic drugs from the control regimen.","[""control_drugs""]",ok,,questions/control_drugs__row_114__In_Pancreatic_trials_with_chemotherapy_control_list_the_specific_cytotoxic_drugs_from_the,questions/control_drugs__row_114__In_Pancreatic_trials_with_chemotherapy_control_list_the_specific_cytotoxic_drugs_from_the/ground_truth_table.csv
row_115,115,"In Gastric/GEJ trials with chemotherapy control, list the specific cytotoxic drugs from the control regimen.","[""control_drugs""]",ok,,questions/control_drugs__row_115__In_Gastric_GEJ_trials_with_chemotherapy_control_list_the_specific_cytotoxic_drugs_from_the,questions/control_drugs__row_115__In_Gastric_GEJ_trials_with_chemotherapy_control_list_the_specific_cytotoxic_drugs_from_the/ground_truth_table.csv
row_116,116,"In Hepatocellular trials, determine whether the listed endpoint is primary or secondary based on the endpoint text.","[""endpoint_role""]",ok,,questions/endpoint_role__row_116__In_Hepatocellular_trials_determine_whether_the_listed_endpoint_is_primary_or_secondary_bas,questions/endpoint_role__row_116__In_Hepatocellular_trials_determine_whether_the_listed_endpoint_is_primary_or_secondary_bas/ground_truth_table.csv
row_117,117,"For Chemotherapy trials, bucket trial phase into early (1/1b/2) vs late (3/4).","[""phase_bucket""]",ok,,questions/phase_bucket__row_117__For_Chemotherapy_trials_bucket_trial_phase_into_early_1_1b_2_vs_late_3_4,questions/phase_bucket__row_117__For_Chemotherapy_trials_bucket_trial_phase_into_early_1_1b_2_vs_late_3_4/ground_truth_table.csv
row_118,118,"In Small Cell Lung Phase 2 trials, standardize the primary endpoint into one of OS, PFS, ORR, DFS, DOR, AE-rate, or Other.","[""primary_endpoint_category""]",ok,,questions/primary_endpoint_category__row_118__In_Small_Cell_Lung_Phase_2_trials_standardize_the_primary_endpoint_into_one_of_OS_PFS_ORR,questions/primary_endpoint_category__row_118__In_Small_Cell_Lung_Phase_2_trials_standardize_the_primary_endpoint_into_one_of_OS_PFS_ORR/ground_truth_table.csv
row_119,119,"In Urothelial trials, classify the ICI by target class from its generic name as PD-1, PD-L1, or CTLA-4.","[""class""]",ok,,questions/class__row_119__In_Urothelial_trials_classify_the_ICI_by_target_class_from_its_generic_name_as_PD_1_PD_L1,questions/class__row_119__In_Urothelial_trials_classify_the_ICI_by_target_class_from_its_generic_name_as_PD_1_PD_L1/ground_truth_table.csv
row_120,120,"For Nivolumab, Ipilimumab trials in NSCLC, extract the trial acronym from the trial name (e.g., KEYNOTE-xxx, CHECKMATE-xxx).","[""trial_acronym""]",ok,,questions/trial_acronym__row_120__For_Nivolumab_Ipilimumab_trials_in_NSCLC_extract_the_trial_acronym_from_the_trial_name_e_g,questions/trial_acronym__row_120__For_Nivolumab_Ipilimumab_trials_in_NSCLC_extract_the_trial_acronym_from_the_trial_name_e_g/ground_truth_table.csv
row_121,121,"In Hepatocellular trials, classify overall follow-up maturity: 'mature' if ≥24 months, else 'immature' (or 'unknown' if missing).","[""maturity""]",ok,,questions/maturity__row_121__In_Hepatocellular_trials_classify_overall_follow_up_maturity_mature_if_24_months_else_imma,questions/maturity__row_121__In_Hepatocellular_trials_classify_overall_follow_up_maturity_mature_if_24_months_else_imma/ground_truth_table.csv
row_123,123,"For Tremelimumab combination therapy trials, list additional agents in the treatment regimen beyond the ICI.","[""added_agents""]",ok,,questions/added_agents__row_123__For_Tremelimumab_combination_therapy_trials_list_additional_agents_in_the_treatment_regime,questions/added_agents__row_123__For_Tremelimumab_combination_therapy_trials_list_additional_agents_in_the_treatment_regime/ground_truth_table.csv
row_124,124,"For Ipilimumab trials in Esophageal/GEJ, extract the trial acronym from the trial name (e.g., KEYNOTE-xxx, CHECKMATE-xxx).","[""trial_acronym""]",ok,,questions/trial_acronym__row_124__For_Ipilimumab_trials_in_Esophageal_GEJ_extract_the_trial_acronym_from_the_trial_name_e_g,questions/trial_acronym__row_124__For_Ipilimumab_trials_in_Esophageal_GEJ_extract_the_trial_acronym_from_the_trial_name_e_g/ground_truth_table.csv
row_125,125,"In Hodgkin Lymphoma trials, convert 'Type of therapy' into is_combination = true/false.","[""is_combination""]",ok,,questions/is_combination__row_125__In_Hodgkin_Lymphoma_trials_convert_Type_of_therapy_into_is_combination_true_false,questions/is_combination__row_125__In_Hodgkin_Lymphoma_trials_convert_Type_of_therapy_into_is_combination_true_false/ground_truth_table.csv
row_126,126,"In Breast trials, convert 'Type of therapy' into is_combination = true/false.","[""is_combination""]",ok,,questions/is_combination__row_126__In_Breast_trials_convert_Type_of_therapy_into_is_combination_true_false,questions/is_combination__row_126__In_Breast_trials_convert_Type_of_therapy_into_is_combination_true_false/ground_truth_table.csv
row_128,128,"In NSCLC trials, classify the ICI by target class from its generic name as PD-1, PD-L1, or CTLA-4.","[""class""]",ok,,questions/class__row_128__In_NSCLC_trials_classify_the_ICI_by_target_class_from_its_generic_name_as_PD_1_PD_L1_or_CT,questions/class__row_128__In_NSCLC_trials_classify_the_ICI_by_target_class_from_its_generic_name_as_PD_1_PD_L1_or_CT/ground_truth_table.csv
row_129,129,"In Melanoma Phase 3 trials, classify the control arm as active, placebo, or best supportive care.","[""control_category""]",ok,,questions/control_category__row_129__In_Melanoma_Phase_3_trials_classify_the_control_arm_as_active_placebo_or_best_supportive_c,questions/control_category__row_129__In_Melanoma_Phase_3_trials_classify_the_control_arm_as_active_placebo_or_best_supportive_c/ground_truth_table.csv
row_130,130,"For Ipilimumab trials, bucket total sample size as small(<100), medium(100–299), or large(≥300).","[""size_bucket""]",ok,,questions/size_bucket__row_130__For_Ipilimumab_trials_bucket_total_sample_size_as_small_100_medium_100_299_or_large_300,questions/size_bucket__row_130__For_Ipilimumab_trials_bucket_total_sample_size_as_small_100_medium_100_299_or_large_300/ground_truth_table.csv
row_131,131,"In Multiple Myeloma trials, convert 'Original/Follow up' status into a boolean is_follow_up.","[""is_follow_up""]",ok,,questions/is_follow_up__row_131__In_Multiple_Myeloma_trials_convert_Original_Follow_up_status_into_a_boolean_is_follow_up,questions/is_follow_up__row_131__In_Multiple_Myeloma_trials_convert_Original_Follow_up_status_into_a_boolean_is_follow_up/ground_truth_table.csv
row_132,132,"In NSCLC combination therapy trials, normalize the combination type to standardized labels (e.g., ICI+Chemo, ICI+TKI, ICI+ICI).","[""combo_type_norm""]",ok,,questions/combo_type_norm__row_132__In_NSCLC_combination_therapy_trials_normalize_the_combination_type_to_standardized_labels,questions/combo_type_norm__row_132__In_NSCLC_combination_therapy_trials_normalize_the_combination_type_to_standardized_labels/ground_truth_table.csv
row_134,134,"In Melanoma trials, convert 'Original/Follow up' status into a boolean is_follow_up.","[""is_follow_up""]",ok,,questions/is_follow_up__row_134__In_Melanoma_trials_convert_Original_Follow_up_status_into_a_boolean_is_follow_up,questions/is_follow_up__row_134__In_Melanoma_trials_convert_Original_Follow_up_status_into_a_boolean_is_follow_up/ground_truth_table.csv
row_136,136,"In Non-Small Cell Lung studies using ICI+TKI, list the TKI agent(s) mentioned in the treatment regimen.","[""tki_agents""]",ok,,questions/tki_agents__row_136__In_Non_Small_Cell_Lung_studies_using_ICI_TKI_list_the_TKI_agent_s_mentioned_in_the_treatme,questions/tki_agents__row_136__In_Non_Small_Cell_Lung_studies_using_ICI_TKI_list_the_TKI_agent_s_mentioned_in_the_treatme/ground_truth_table.csv
row_137,137,"In Hodgkin Lymphoma trials, interpret the PD-L1 requirement flag as boolean true/false.","[""pd_l1_required""]",ok,,questions/pd_l1_required__row_137__In_Hodgkin_Lymphoma_trials_interpret_the_PD_L1_requirement_flag_as_boolean_true_false,questions/pd_l1_required__row_137__In_Hodgkin_Lymphoma_trials_interpret_the_PD_L1_requirement_flag_as_boolean_true_false/ground_truth_table.csv
row_138,138,"In Breast trials, from the secondary endpoint text flag if immune-related adverse events (irAEs) were explicitly assessed.","[""irAE_assessed""]",ok,,questions/irAE_assessed__row_138__In_Breast_trials_from_the_secondary_endpoint_text_flag_if_immune_related_adverse_events_ir,questions/irAE_assessed__row_138__In_Breast_trials_from_the_secondary_endpoint_text_flag_if_immune_related_adverse_events_ir/ground_truth_table.csv
row_139,139,"For Avelumab trials in Head and Neck, extract the trial acronym from the trial name (e.g., KEYNOTE-xxx, CHECKMATE-xxx).","[""trial_acronym""]",ok,,questions/trial_acronym__row_139__For_Avelumab_trials_in_Head_and_Neck_extract_the_trial_acronym_from_the_trial_name_e_g_KEY,questions/trial_acronym__row_139__For_Avelumab_trials_in_Head_and_Neck_extract_the_trial_acronym_from_the_trial_name_e_g_KEY/ground_truth_table.csv
row_142,142,"For Atezolizumab+Trastuzumab emtansine+Placebo trials, bucket the publication year into: ≤2014, 2015–2018, ≥2019.","[""era""]",ok,,questions/era__row_142__For_Atezolizumab_Trastuzumab_emtansine_Placebo_trials_bucket_the_publication_year_into_201,questions/era__row_142__For_Atezolizumab_Trastuzumab_emtansine_Placebo_trials_bucket_the_publication_year_into_201/ground_truth_table.csv
row_143,143,"In Prostate trials, interpret the PD-L1 requirement flag as boolean true/false.","[""pd_l1_required""]",ok,,questions/pd_l1_required__row_143__In_Prostate_trials_interpret_the_PD_L1_requirement_flag_as_boolean_true_false,questions/pd_l1_required__row_143__In_Prostate_trials_interpret_the_PD_L1_requirement_flag_as_boolean_true_false/ground_truth_table.csv
row_144,144,"In Non-Small Cell Lung trials, classify the ICI by target class from its generic name as PD-1, PD-L1, or CTLA-4.","[""class""]",ok,,questions/class__row_144__In_Non_Small_Cell_Lung_trials_classify_the_ICI_by_target_class_from_its_generic_name_as_PD,questions/class__row_144__In_Non_Small_Cell_Lung_trials_classify_the_ICI_by_target_class_from_its_generic_name_as_PD/ground_truth_table.csv
row_145,145,"In Renal cell combination therapy trials, normalize the combination type to standardized labels (e.g., ICI+Chemo, ICI+TKI, ICI+ICI).","[""combo_type_norm""]",ok,,questions/combo_type_norm__row_145__In_Renal_cell_combination_therapy_trials_normalize_the_combination_type_to_standardized_la,questions/combo_type_norm__row_145__In_Renal_cell_combination_therapy_trials_normalize_the_combination_type_to_standardized_la/ground_truth_table.csv
row_148,148,"In Head and Neck Phase 3 trials, classify the control arm as active, placebo, or best supportive care.","[""control_category""]",ok,,questions/control_category__row_148__In_Head_and_Neck_Phase_3_trials_classify_the_control_arm_as_active_placebo_or_best_support,questions/control_category__row_148__In_Head_and_Neck_Phase_3_trials_classify_the_control_arm_as_active_placebo_or_best_support/ground_truth_table.csv
row_149,149,"In Melanoma trials, normalize the clinical setting to one of: neoadjuvant, adjuvant, perioperative, metastatic/advanced.","[""setting_normalized""]",ok,,questions/setting_normalized__row_149__In_Melanoma_trials_normalize_the_clinical_setting_to_one_of_neoadjuvant_adjuvant_periopera,questions/setting_normalized__row_149__In_Melanoma_trials_normalize_the_clinical_setting_to_one_of_neoadjuvant_adjuvant_periopera/ground_truth_table.csv
row_150,150,"In Mesothelioma trials, determine whether the listed endpoint is primary or secondary based on the endpoint text.","[""endpoint_role""]",ok,,questions/endpoint_role__row_150__In_Mesothelioma_trials_determine_whether_the_listed_endpoint_is_primary_or_secondary_based,questions/endpoint_role__row_150__In_Mesothelioma_trials_determine_whether_the_listed_endpoint_is_primary_or_secondary_based/ground_truth_table.csv
row_151,151,"In Prostate trials with chemotherapy control, list the specific cytotoxic drugs from the control regimen.","[""control_drugs""]",ok,,questions/control_drugs__row_151__In_Prostate_trials_with_chemotherapy_control_list_the_specific_cytotoxic_drugs_from_the_co,questions/control_drugs__row_151__In_Prostate_trials_with_chemotherapy_control_list_the_specific_cytotoxic_drugs_from_the_co/ground_truth_table.csv
row_152,152,"In Prostate trials, determine whether the listed endpoint is primary or secondary based on the endpoint text.","[""endpoint_role""]",ok,,questions/endpoint_role__row_152__In_Prostate_trials_determine_whether_the_listed_endpoint_is_primary_or_secondary_based_on,questions/endpoint_role__row_152__In_Prostate_trials_determine_whether_the_listed_endpoint_is_primary_or_secondary_based_on/ground_truth_table.csv
row_153,153,"For Atezolizumab combination therapy trials, list additional agents in the treatment regimen beyond the ICI.","[""added_agents""]",ok,,questions/added_agents__row_153__For_Atezolizumab_combination_therapy_trials_list_additional_agents_in_the_treatment_regime,questions/added_agents__row_153__For_Atezolizumab_combination_therapy_trials_list_additional_agents_in_the_treatment_regime/ground_truth_table.csv
row_154,154,"In Head and Neck Phase 3 trials, standardize the primary endpoint into one of OS, PFS, ORR, DFS, DOR, AE-rate, or Other.","[""primary_endpoint_category""]",ok,,questions/primary_endpoint_category__row_154__In_Head_and_Neck_Phase_3_trials_standardize_the_primary_endpoint_into_one_of_OS_PFS_ORR_DF,questions/primary_endpoint_category__row_154__In_Head_and_Neck_Phase_3_trials_standardize_the_primary_endpoint_into_one_of_OS_PFS_ORR_DF/ground_truth_table.csv
row_155,155,"In Head and Neck trials, categorize number of arms as 1-arm, 2-arm, or ≥3-arm.","[""arm_category""]",ok,,questions/arm_category__row_155__In_Head_and_Neck_trials_categorize_number_of_arms_as_1_arm_2_arm_or_3_arm,questions/arm_category__row_155__In_Head_and_Neck_trials_categorize_number_of_arms_as_1_arm_2_arm_or_3_arm/ground_truth_table.csv
row_156,156,"In Multiple Myeloma trials with PD-L1 agents included in the meta-analysis, map the generic ICI name to its brand name.","[""brand_name""]",ok,,questions/brand_name__row_156__In_Multiple_Myeloma_trials_with_PD_L1_agents_included_in_the_meta_analysis_map_the_generic,questions/brand_name__row_156__In_Multiple_Myeloma_trials_with_PD_L1_agents_included_in_the_meta_analysis_map_the_generic/ground_truth_table.csv
row_157,157,"In Pancreatic Phase 3 trials, classify the control arm as active, placebo, or best supportive care.","[""control_category""]",ok,,questions/control_category__row_157__In_Pancreatic_Phase_3_trials_classify_the_control_arm_as_active_placebo_or_best_supportive,questions/control_category__row_157__In_Pancreatic_Phase_3_trials_classify_the_control_arm_as_active_placebo_or_best_supportive/ground_truth_table.csv
