item_id,csv_row_number,question,expected_keys_json,status,error,question_dir,ground_truth_table_csv
row_2,2,"In Small Cell Lung trials, classify the ICI by target class from its generic name as PD-1, PD-L1, or CTLA-4.","[""class""]",ok,,questions/class__row_2__In_Small_Cell_Lung_trials_classify_the_ICI_by_target_class_from_its_generic_name_as_PD_1_P,questions/class__row_2__In_Small_Cell_Lung_trials_classify_the_ICI_by_target_class_from_its_generic_name_as_PD_1_P/ground_truth_table.csv
row_3,3,"In Esophageal/GEJ trials, convert 'Original/Follow up' status into a boolean is_follow_up.","[""is_follow_up""]",ok,,questions/is_follow_up__row_3__In_Esophageal_GEJ_trials_convert_Original_Follow_up_status_into_a_boolean_is_follow_up,questions/is_follow_up__row_3__In_Esophageal_GEJ_trials_convert_Original_Follow_up_status_into_a_boolean_is_follow_up/ground_truth_table.csv
row_4,4,"In Prostate trials, convert 'Type of therapy' into is_combination = true/false.","[""is_combination""]",ok,,questions/is_combination__row_4__In_Prostate_trials_convert_Type_of_therapy_into_is_combination_true_false,questions/is_combination__row_4__In_Prostate_trials_convert_Type_of_therapy_into_is_combination_true_false/ground_truth_table.csv
row_5,5,"For Avelumab trials in Multiple Myeloma, extract the trial acronym from the trial name (e.g., KEYNOTE-xxx, CHECKMATE-xxx).","[""trial_acronym""]",ok,,questions/trial_acronym__row_5__For_Avelumab_trials_in_Multiple_Myeloma_extract_the_trial_acronym_from_the_trial_name_e_g,questions/trial_acronym__row_5__For_Avelumab_trials_in_Multiple_Myeloma_extract_the_trial_acronym_from_the_trial_name_e_g/ground_truth_table.csv
row_6,6,"In NSCLC studies using ICI+TKI, list the TKI agent(s) mentioned in the treatment regimen.","[""tki_agents""]",ok,,questions/tki_agents__row_6__In_NSCLC_studies_using_ICI_TKI_list_the_TKI_agent_s_mentioned_in_the_treatment_regimen,questions/tki_agents__row_6__In_NSCLC_studies_using_ICI_TKI_list_the_TKI_agent_s_mentioned_in_the_treatment_regimen/ground_truth_table.csv
row_8,8,"For Atezolizumab trials, bucket the publication year into: ≤2014, 2015–2018, ≥2019.","[""era""]",ok,,questions/era__row_8__For_Atezolizumab_trials_bucket_the_publication_year_into_2014_2015_2018_2019,questions/era__row_8__For_Atezolizumab_trials_bucket_the_publication_year_into_2014_2015_2018_2019/ground_truth_table.csv
row_11,11,"For Nivolumab, Ipilimumab trials in Hodgkin Lymphoma, extract the trial acronym from the trial name (e.g., KEYNOTE-xxx, CHECKMATE-xxx).","[""trial_acronym""]",ok,,questions/trial_acronym__row_11__For_Nivolumab_Ipilimumab_trials_in_Hodgkin_Lymphoma_extract_the_trial_acronym_from_the_tri,questions/trial_acronym__row_11__For_Nivolumab_Ipilimumab_trials_in_Hodgkin_Lymphoma_extract_the_trial_acronym_from_the_tri/ground_truth_table.csv
row_14,14,"For Durvalumab, Tremelimumab trials in Head and Neck, extract the trial acronym from the trial name (e.g., KEYNOTE-xxx, CHECKMATE-xxx).","[""trial_acronym""]",ok,,questions/trial_acronym__row_14__For_Durvalumab_Tremelimumab_trials_in_Head_and_Neck_extract_the_trial_acronym_from_the_tri,questions/trial_acronym__row_14__For_Durvalumab_Tremelimumab_trials_in_Head_and_Neck_extract_the_trial_acronym_from_the_tri/ground_truth_table.csv
row_16,16,"In Head and Neck trials, from the secondary endpoint text flag if immune-related adverse events (irAEs) were explicitly assessed.","[""irAE_assessed""]",ok,,questions/irAE_assessed__row_16__In_Head_and_Neck_trials_from_the_secondary_endpoint_text_flag_if_immune_related_adverse_ev,questions/irAE_assessed__row_16__In_Head_and_Neck_trials_from_the_secondary_endpoint_text_flag_if_immune_related_adverse_ev/ground_truth_table.csv
row_17,17,"For Atezolizumab trials in Pancreatic, extract the trial acronym from the trial name (e.g., KEYNOTE-xxx, CHECKMATE-xxx).","[""trial_acronym""]",ok,,questions/trial_acronym__row_17__For_Atezolizumab_trials_in_Pancreatic_extract_the_trial_acronym_from_the_trial_name_e_g_KE,questions/trial_acronym__row_17__For_Atezolizumab_trials_in_Pancreatic_extract_the_trial_acronym_from_the_trial_name_e_g_KE/ground_truth_table.csv
row_20,20,"In Mesothelioma trials, categorize number of arms as 1-arm, 2-arm, or ≥3-arm.","[""arm_category""]",ok,,questions/arm_category__row_20__In_Mesothelioma_trials_categorize_number_of_arms_as_1_arm_2_arm_or_3_arm,questions/arm_category__row_20__In_Mesothelioma_trials_categorize_number_of_arms_as_1_arm_2_arm_or_3_arm/ground_truth_table.csv
row_21,21,"For Chemotherapy trials in Melanoma, extract the trial acronym from the trial name (e.g., KEYNOTE-xxx, CHECKMATE-xxx).","[""trial_acronym""]",ok,,questions/trial_acronym__row_21__For_Chemotherapy_trials_in_Melanoma_extract_the_trial_acronym_from_the_trial_name_e_g_KEYN,questions/trial_acronym__row_21__For_Chemotherapy_trials_in_Melanoma_extract_the_trial_acronym_from_the_trial_name_e_g_KEYN/ground_truth_table.csv
row_22,22,"In Esophageal/GEJ combination therapy trials, normalize the combination type to standardized labels (e.g., ICI+Chemo, ICI+TKI, ICI+ICI).","[""combo_type_norm""]",ok,,questions/combo_type_norm__row_22__In_Esophageal_GEJ_combination_therapy_trials_normalize_the_combination_type_to_standardize,questions/combo_type_norm__row_22__In_Esophageal_GEJ_combination_therapy_trials_normalize_the_combination_type_to_standardize/ground_truth_table.csv
row_23,23,"In Hodgkin Lymphoma trials, normalize the clinical setting to one of: neoadjuvant, adjuvant, perioperative, metastatic/advanced.","[""setting_normalized""]",ok,,questions/setting_normalized__row_23__In_Hodgkin_Lymphoma_trials_normalize_the_clinical_setting_to_one_of_neoadjuvant_adjuvant_p,questions/setting_normalized__row_23__In_Hodgkin_Lymphoma_trials_normalize_the_clinical_setting_to_one_of_neoadjuvant_adjuvant_p/ground_truth_table.csv
row_24,24,"In NSCLC trials with chemotherapy control, list the specific cytotoxic drugs from the control regimen.","[""control_drugs""]",ok,,questions/control_drugs__row_24__In_NSCLC_trials_with_chemotherapy_control_list_the_specific_cytotoxic_drugs_from_the_contr,questions/control_drugs__row_24__In_NSCLC_trials_with_chemotherapy_control_list_the_specific_cytotoxic_drugs_from_the_contr/ground_truth_table.csv
row_25,25,"In Melanoma trials, determine whether the listed endpoint is primary or secondary based on the endpoint text.","[""endpoint_role""]",ok,,questions/endpoint_role__row_25__In_Melanoma_trials_determine_whether_the_listed_endpoint_is_primary_or_secondary_based_on,questions/endpoint_role__row_25__In_Melanoma_trials_determine_whether_the_listed_endpoint_is_primary_or_secondary_based_on/ground_truth_table.csv
row_26,26,"In Small Cell Lung Phase 3 trials, classify the control arm as active, placebo, or best supportive care.","[""control_category""]",ok,,questions/control_category__row_26__In_Small_Cell_Lung_Phase_3_trials_classify_the_control_arm_as_active_placebo_or_best_suppo,questions/control_category__row_26__In_Small_Cell_Lung_Phase_3_trials_classify_the_control_arm_as_active_placebo_or_best_suppo/ground_truth_table.csv
row_27,27,"In Renal cell Phase 3 trials, classify the control arm as active, placebo, or best supportive care.","[""control_category""]",ok,,questions/control_category__row_27__In_Renal_cell_Phase_3_trials_classify_the_control_arm_as_active_placebo_or_best_supportive,questions/control_category__row_27__In_Renal_cell_Phase_3_trials_classify_the_control_arm_as_active_placebo_or_best_supportive/ground_truth_table.csv
row_28,28,"In Breast trials, determine whether the listed endpoint is primary or secondary based on the endpoint text.","[""endpoint_role""]",ok,,questions/endpoint_role__row_28__In_Breast_trials_determine_whether_the_listed_endpoint_is_primary_or_secondary_based_on_th,questions/endpoint_role__row_28__In_Breast_trials_determine_whether_the_listed_endpoint_is_primary_or_secondary_based_on_th/ground_truth_table.csv
row_29,29,"In Colorectal trials, determine whether the listed endpoint is primary or secondary based on the endpoint text.","[""endpoint_role""]",ok,,questions/endpoint_role__row_29__In_Colorectal_trials_determine_whether_the_listed_endpoint_is_primary_or_secondary_based_o,questions/endpoint_role__row_29__In_Colorectal_trials_determine_whether_the_listed_endpoint_is_primary_or_secondary_based_o/ground_truth_table.csv
row_31,31,"In Head and Neck studies using ICI+TKI, list the TKI agent(s) mentioned in the treatment regimen.","[""tki_agents""]",ok,,questions/tki_agents__row_31__In_Head_and_Neck_studies_using_ICI_TKI_list_the_TKI_agent_s_mentioned_in_the_treatment_reg,questions/tki_agents__row_31__In_Head_and_Neck_studies_using_ICI_TKI_list_the_TKI_agent_s_mentioned_in_the_treatment_reg/ground_truth_table.csv
row_33,33,"In Urothelial Phase 3 trials, classify the control arm as active, placebo, or best supportive care.","[""control_category""]",ok,,questions/control_category__row_33__In_Urothelial_Phase_3_trials_classify_the_control_arm_as_active_placebo_or_best_supportive,questions/control_category__row_33__In_Urothelial_Phase_3_trials_classify_the_control_arm_as_active_placebo_or_best_supportive/ground_truth_table.csv
row_34,34,"In Bladder trials, normalize the clinical setting to one of: neoadjuvant, adjuvant, perioperative, metastatic/advanced.","[""setting_normalized""]",ok,,questions/setting_normalized__row_34__In_Bladder_trials_normalize_the_clinical_setting_to_one_of_neoadjuvant_adjuvant_perioperat,questions/setting_normalized__row_34__In_Bladder_trials_normalize_the_clinical_setting_to_one_of_neoadjuvant_adjuvant_perioperat/ground_truth_table.csv
row_35,35,"In Pancreatic trials, convert 'Type of therapy' into is_combination = true/false.","[""is_combination""]",ok,,questions/is_combination__row_35__In_Pancreatic_trials_convert_Type_of_therapy_into_is_combination_true_false,questions/is_combination__row_35__In_Pancreatic_trials_convert_Type_of_therapy_into_is_combination_true_false/ground_truth_table.csv
row_36,36,"In Gastric/GEJ trials, classify the ICI by target class from its generic name as PD-1, PD-L1, or CTLA-4.","[""class""]",ok,,questions/class__row_36__In_Gastric_GEJ_trials_classify_the_ICI_by_target_class_from_its_generic_name_as_PD_1_PD_L1,questions/class__row_36__In_Gastric_GEJ_trials_classify_the_ICI_by_target_class_from_its_generic_name_as_PD_1_PD_L1/ground_truth_table.csv
row_37,37,"In Gastric/GEJ combination therapy trials, normalize the combination type to standardized labels (e.g., ICI+Chemo, ICI+TKI, ICI+ICI).","[""combo_type_norm""]",ok,,questions/combo_type_norm__row_37__In_Gastric_GEJ_combination_therapy_trials_normalize_the_combination_type_to_standardized_l,questions/combo_type_norm__row_37__In_Gastric_GEJ_combination_therapy_trials_normalize_the_combination_type_to_standardized_l/ground_truth_table.csv
row_38,38,"In Hepatocellular trials, interpret the PD-L1 requirement flag as boolean true/false.","[""pd_l1_required""]",ok,,questions/pd_l1_required__row_38__In_Hepatocellular_trials_interpret_the_PD_L1_requirement_flag_as_boolean_true_false,questions/pd_l1_required__row_38__In_Hepatocellular_trials_interpret_the_PD_L1_requirement_flag_as_boolean_true_false/ground_truth_table.csv
row_40,40,"For trials retrieved, construct a PubMed URL from the PubMed ID.","[""pubmed_url""]",ok,,questions/pubmed_url__row_40__For_trials_retrieved_construct_a_PubMed_URL_from_the_PubMed_ID,questions/pubmed_url__row_40__For_trials_retrieved_construct_a_PubMed_URL_from_the_PubMed_ID/ground_truth_table.csv
row_41,41,"In Hodgkin Lymphoma trials, classify overall follow-up maturity: 'mature' if ≥24 months, else 'immature' (or 'unknown' if missing).","[""maturity""]",ok,,questions/maturity__row_41__In_Hodgkin_Lymphoma_trials_classify_overall_follow_up_maturity_mature_if_24_months_else_im,questions/maturity__row_41__In_Hodgkin_Lymphoma_trials_classify_overall_follow_up_maturity_mature_if_24_months_else_im/ground_truth_table.csv
row_42,42,"In Head and Neck trials, classify overall follow-up maturity: 'mature' if ≥24 months, else 'immature' (or 'unknown' if missing).","[""maturity""]",ok,,questions/maturity__row_42__In_Head_and_Neck_trials_classify_overall_follow_up_maturity_mature_if_24_months_else_immat,questions/maturity__row_42__In_Head_and_Neck_trials_classify_overall_follow_up_maturity_mature_if_24_months_else_immat/ground_truth_table.csv
row_44,44,"In Esophageal/GEJ Phase 2 trials, standardize the primary endpoint into one of OS, PFS, ORR, DFS, DOR, AE-rate, or Other.","[""primary_endpoint_category""]",ok,,questions/primary_endpoint_category__row_44__In_Esophageal_GEJ_Phase_2_trials_standardize_the_primary_endpoint_into_one_of_OS_PFS_ORR_D,questions/primary_endpoint_category__row_44__In_Esophageal_GEJ_Phase_2_trials_standardize_the_primary_endpoint_into_one_of_OS_PFS_ORR_D/ground_truth_table.csv
row_45,45,"In melanoma trials using ICI plus BRAFi+MEKi, list the BRAF and MEK inhibitors used in the regimen.","[""braf_inhibitor"", ""mek_inhibitor""]",ok,,questions/braf_inhibitor_mek_inhibitor__row_45__In_melanoma_trials_using_ICI_plus_BRAFi_MEKi_list_the_BRAF_and_MEK_inhibitors_used_in_the,questions/braf_inhibitor_mek_inhibitor__row_45__In_melanoma_trials_using_ICI_plus_BRAFi_MEKi_list_the_BRAF_and_MEK_inhibitors_used_in_the/ground_truth_table.csv
row_46,46,"In Hepatocellular studies using ICI+TKI, list the TKI agent(s) mentioned in the treatment regimen.","[""tki_agents""]",ok,,questions/tki_agents__row_46__In_Hepatocellular_studies_using_ICI_TKI_list_the_TKI_agent_s_mentioned_in_the_treatment_re,questions/tki_agents__row_46__In_Hepatocellular_studies_using_ICI_TKI_list_the_TKI_agent_s_mentioned_in_the_treatment_re/ground_truth_table.csv
row_47,47,"For Avelumab trials, bucket total sample size as small(<100), medium(100–299), or large(≥300).","[""size_bucket""]",ok,,questions/size_bucket__row_47__For_Avelumab_trials_bucket_total_sample_size_as_small_100_medium_100_299_or_large_300,questions/size_bucket__row_47__For_Avelumab_trials_bucket_total_sample_size_as_small_100_medium_100_299_or_large_300/ground_truth_table.csv
row_48,48,"In Melanoma Phase 2 trials, standardize the primary endpoint into one of OS, PFS, ORR, DFS, DOR, AE-rate, or Other.","[""primary_endpoint_category""]",ok,,questions/primary_endpoint_category__row_48__In_Melanoma_Phase_2_trials_standardize_the_primary_endpoint_into_one_of_OS_PFS_ORR_DFS_DOR,questions/primary_endpoint_category__row_48__In_Melanoma_Phase_2_trials_standardize_the_primary_endpoint_into_one_of_OS_PFS_ORR_DFS_DOR/ground_truth_table.csv
row_50,50,"In Mesothelioma Phase 3 trials, standardize the primary endpoint into one of OS, PFS, ORR, DFS, DOR, AE-rate, or Other.","[""primary_endpoint_category""]",ok,,questions/primary_endpoint_category__row_50__In_Mesothelioma_Phase_3_trials_standardize_the_primary_endpoint_into_one_of_OS_PFS_ORR_DFS,questions/primary_endpoint_category__row_50__In_Mesothelioma_Phase_3_trials_standardize_the_primary_endpoint_into_one_of_OS_PFS_ORR_DFS/ground_truth_table.csv
row_51,51,"In Hodgkin Lymphoma trials, convert 'Original/Follow up' status into a boolean is_follow_up.","[""is_follow_up""]",ok,,questions/is_follow_up__row_51__In_Hodgkin_Lymphoma_trials_convert_Original_Follow_up_status_into_a_boolean_is_follow_up,questions/is_follow_up__row_51__In_Hodgkin_Lymphoma_trials_convert_Original_Follow_up_status_into_a_boolean_is_follow_up/ground_truth_table.csv
row_53,53,"In Multiple Myeloma Phase 3 trials, standardize the primary endpoint into one of OS, PFS, ORR, DFS, DOR, AE-rate, or Other.","[""primary_endpoint_category""]",ok,,questions/primary_endpoint_category__row_53__In_Multiple_Myeloma_Phase_3_trials_standardize_the_primary_endpoint_into_one_of_OS_PFS_ORR,questions/primary_endpoint_category__row_53__In_Multiple_Myeloma_Phase_3_trials_standardize_the_primary_endpoint_into_one_of_OS_PFS_ORR/ground_truth_table.csv
row_56,56,"In Multiple Myeloma trials, from the secondary endpoint text flag if immune-related adverse events (irAEs) were explicitly assessed.","[""irAE_assessed""]",ok,,questions/irAE_assessed__row_56__In_Multiple_Myeloma_trials_from_the_secondary_endpoint_text_flag_if_immune_related_adverse,questions/irAE_assessed__row_56__In_Multiple_Myeloma_trials_from_the_secondary_endpoint_text_flag_if_immune_related_adverse/ground_truth_table.csv
row_57,57,"For Durvalumab, Tremelimumab trials, bucket the publication year into: ≤2014, 2015–2018, ≥2019.","[""era""]",ok,,questions/era__row_57__For_Durvalumab_Tremelimumab_trials_bucket_the_publication_year_into_2014_2015_2018_2019,questions/era__row_57__For_Durvalumab_Tremelimumab_trials_bucket_the_publication_year_into_2014_2015_2018_2019/ground_truth_table.csv
row_58,58,"In Melanoma combination therapy trials, normalize the combination type to standardized labels (e.g., ICI+Chemo, ICI+TKI, ICI+ICI).","[""combo_type_norm""]",ok,,questions/combo_type_norm__row_58__In_Melanoma_combination_therapy_trials_normalize_the_combination_type_to_standardized_labe,questions/combo_type_norm__row_58__In_Melanoma_combination_therapy_trials_normalize_the_combination_type_to_standardized_labe/ground_truth_table.csv
row_60,60,"In Gastric/GEJ trials, convert 'Type of therapy' into is_combination = true/false.","[""is_combination""]",ok,,questions/is_combination__row_60__In_Gastric_GEJ_trials_convert_Type_of_therapy_into_is_combination_true_false,questions/is_combination__row_60__In_Gastric_GEJ_trials_convert_Type_of_therapy_into_is_combination_true_false/ground_truth_table.csv
row_62,62,"In Bladder trials, classify overall follow-up maturity: 'mature' if ≥24 months, else 'immature' (or 'unknown' if missing).","[""maturity""]",ok,,questions/maturity__row_62__In_Bladder_trials_classify_overall_follow_up_maturity_mature_if_24_months_else_immature_or,questions/maturity__row_62__In_Bladder_trials_classify_overall_follow_up_maturity_mature_if_24_months_else_immature_or/ground_truth_table.csv
row_64,64,"In Colorectal trials, classify overall follow-up maturity: 'mature' if ≥24 months, else 'immature' (or 'unknown' if missing).","[""maturity""]",ok,,questions/maturity__row_64__In_Colorectal_trials_classify_overall_follow_up_maturity_mature_if_24_months_else_immature,questions/maturity__row_64__In_Colorectal_trials_classify_overall_follow_up_maturity_mature_if_24_months_else_immature/ground_truth_table.csv
row_65,65,"In Renal cell trials, normalize the clinical setting to one of: neoadjuvant, adjuvant, perioperative, metastatic/advanced.","[""setting_normalized""]",ok,,questions/setting_normalized__row_65__In_Renal_cell_trials_normalize_the_clinical_setting_to_one_of_neoadjuvant_adjuvant_periope,questions/setting_normalized__row_65__In_Renal_cell_trials_normalize_the_clinical_setting_to_one_of_neoadjuvant_adjuvant_periope/ground_truth_table.csv
row_66,66,"In Colorectal Phase 2 trials, standardize the primary endpoint into one of OS, PFS, ORR, DFS, DOR, AE-rate, or Other.","[""primary_endpoint_category""]",ok,,questions/primary_endpoint_category__row_66__In_Colorectal_Phase_2_trials_standardize_the_primary_endpoint_into_one_of_OS_PFS_ORR_DFS_D,questions/primary_endpoint_category__row_66__In_Colorectal_Phase_2_trials_standardize_the_primary_endpoint_into_one_of_OS_PFS_ORR_DFS_D/ground_truth_table.csv
row_67,67,"In NSCLC trials, normalize the clinical setting to one of: neoadjuvant, adjuvant, perioperative, metastatic/advanced.","[""setting_normalized""]",ok,,questions/setting_normalized__row_67__In_NSCLC_trials_normalize_the_clinical_setting_to_one_of_neoadjuvant_adjuvant_perioperativ,questions/setting_normalized__row_67__In_NSCLC_trials_normalize_the_clinical_setting_to_one_of_neoadjuvant_adjuvant_perioperativ/ground_truth_table.csv
row_68,68,"In Bladder trials, convert 'Original/Follow up' status into a boolean is_follow_up.","[""is_follow_up""]",ok,,questions/is_follow_up__row_68__In_Bladder_trials_convert_Original_Follow_up_status_into_a_boolean_is_follow_up,questions/is_follow_up__row_68__In_Bladder_trials_convert_Original_Follow_up_status_into_a_boolean_is_follow_up/ground_truth_table.csv
row_69,69,"In Prostate studies using ICI+TKI, list the TKI agent(s) mentioned in the treatment regimen.","[""tki_agents""]",ok,,questions/tki_agents__row_69__In_Prostate_studies_using_ICI_TKI_list_the_TKI_agent_s_mentioned_in_the_treatment_regimen,questions/tki_agents__row_69__In_Prostate_studies_using_ICI_TKI_list_the_TKI_agent_s_mentioned_in_the_treatment_regimen/ground_truth_table.csv
row_70,70,"In Mesothelioma trials, from the secondary endpoint text flag if immune-related adverse events (irAEs) were explicitly assessed.","[""irAE_assessed""]",ok,,questions/irAE_assessed__row_70__In_Mesothelioma_trials_from_the_secondary_endpoint_text_flag_if_immune_related_adverse_eve,questions/irAE_assessed__row_70__In_Mesothelioma_trials_from_the_secondary_endpoint_text_flag_if_immune_related_adverse_eve/ground_truth_table.csv
row_71,71,"In Bladder trials, classify the ICI by target class from its generic name as PD-1, PD-L1, or CTLA-4.","[""class""]",ok,,questions/class__row_71__In_Bladder_trials_classify_the_ICI_by_target_class_from_its_generic_name_as_PD_1_PD_L1_or,questions/class__row_71__In_Bladder_trials_classify_the_ICI_by_target_class_from_its_generic_name_as_PD_1_PD_L1_or/ground_truth_table.csv
row_72,72,"For Brentuximab-vedotin trials in Breast, extract the trial acronym from the trial name (e.g., KEYNOTE-xxx, CHECKMATE-xxx).","[""trial_acronym""]",ok,,questions/trial_acronym__row_72__For_Brentuximab_vedotin_trials_in_Breast_extract_the_trial_acronym_from_the_trial_name_e_g,questions/trial_acronym__row_72__For_Brentuximab_vedotin_trials_in_Breast_extract_the_trial_acronym_from_the_trial_name_e_g/ground_truth_table.csv
row_73,73,"In Mesothelioma trials, classify overall follow-up maturity: 'mature' if ≥24 months, else 'immature' (or 'unknown' if missing).","[""maturity""]",ok,,questions/maturity__row_73__In_Mesothelioma_trials_classify_overall_follow_up_maturity_mature_if_24_months_else_immatu,questions/maturity__row_73__In_Mesothelioma_trials_classify_overall_follow_up_maturity_mature_if_24_months_else_immatu/ground_truth_table.csv
row_74,74,"In Renal cell studies using ICI+TKI, list the TKI agent(s) mentioned in the treatment regimen.","[""tki_agents""]",ok,,questions/tki_agents__row_74__In_Renal_cell_studies_using_ICI_TKI_list_the_TKI_agent_s_mentioned_in_the_treatment_regime,questions/tki_agents__row_74__In_Renal_cell_studies_using_ICI_TKI_list_the_TKI_agent_s_mentioned_in_the_treatment_regime/ground_truth_table.csv
row_75,75,"In Colorectal trials, convert 'Original/Follow up' status into a boolean is_follow_up.","[""is_follow_up""]",ok,,questions/is_follow_up__row_75__In_Colorectal_trials_convert_Original_Follow_up_status_into_a_boolean_is_follow_up,questions/is_follow_up__row_75__In_Colorectal_trials_convert_Original_Follow_up_status_into_a_boolean_is_follow_up/ground_truth_table.csv
row_76,76,"In Melanoma trials with PD-L1 agents included in the meta-analysis, map the generic ICI name to its brand name.","[""brand_name""]",ok,,questions/brand_name__row_76__In_Melanoma_trials_with_PD_L1_agents_included_in_the_meta_analysis_map_the_generic_ICI_nam,questions/brand_name__row_76__In_Melanoma_trials_with_PD_L1_agents_included_in_the_meta_analysis_map_the_generic_ICI_nam/ground_truth_table.csv
row_78,78,"In Pancreatic trials, classify overall follow-up maturity: 'mature' if ≥24 months, else 'immature' (or 'unknown' if missing).","[""maturity""]",ok,,questions/maturity__row_78__In_Pancreatic_trials_classify_overall_follow_up_maturity_mature_if_24_months_else_immature,questions/maturity__row_78__In_Pancreatic_trials_classify_overall_follow_up_maturity_mature_if_24_months_else_immature/ground_truth_table.csv
row_79,79,"In Pancreatic trials, from the secondary endpoint text flag if immune-related adverse events (irAEs) were explicitly assessed.","[""irAE_assessed""]",ok,,questions/irAE_assessed__row_79__In_Pancreatic_trials_from_the_secondary_endpoint_text_flag_if_immune_related_adverse_event,questions/irAE_assessed__row_79__In_Pancreatic_trials_from_the_secondary_endpoint_text_flag_if_immune_related_adverse_event/ground_truth_table.csv
row_80,80,"In Head and Neck combination therapy trials, normalize the combination type to standardized labels (e.g., ICI+Chemo, ICI+TKI, ICI+ICI).","[""combo_type_norm""]",ok,,questions/combo_type_norm__row_80__In_Head_and_Neck_combination_therapy_trials_normalize_the_combination_type_to_standardized,questions/combo_type_norm__row_80__In_Head_and_Neck_combination_therapy_trials_normalize_the_combination_type_to_standardized/ground_truth_table.csv
row_81,81,"For Avelumab trials, bucket trial phase into early (1/1b/2) vs late (3/4).","[""phase_bucket""]",ok,,questions/phase_bucket__row_81__For_Avelumab_trials_bucket_trial_phase_into_early_1_1b_2_vs_late_3_4,questions/phase_bucket__row_81__For_Avelumab_trials_bucket_trial_phase_into_early_1_1b_2_vs_late_3_4/ground_truth_table.csv
row_82,82,"In Colorectal trials, interpret the PD-L1 requirement flag as boolean true/false.","[""pd_l1_required""]",ok,,questions/pd_l1_required__row_82__In_Colorectal_trials_interpret_the_PD_L1_requirement_flag_as_boolean_true_false,questions/pd_l1_required__row_82__In_Colorectal_trials_interpret_the_PD_L1_requirement_flag_as_boolean_true_false/ground_truth_table.csv
row_83,83,"In Multiple Myeloma trials, classify the ICI by target class from its generic name as PD-1, PD-L1, or CTLA-4.","[""class""]",ok,,questions/class__row_83__In_Multiple_Myeloma_trials_classify_the_ICI_by_target_class_from_its_generic_name_as_PD_1,questions/class__row_83__In_Multiple_Myeloma_trials_classify_the_ICI_by_target_class_from_its_generic_name_as_PD_1/ground_truth_table.csv
