item_id,csv_row_number,question,expected_keys_json,status,error,question_dir,ground_truth_table_csv
row_158,158,"In Non-Small Cell Lung combination therapy trials, normalize the combination type to standardized labels (e.g., ICI+Chemo, ICI+TKI, ICI+ICI).","[""combo_type_norm""]",ok,,questions/combo_type_norm__row_158__In_Non_Small_Cell_Lung_combination_therapy_trials_normalize_the_combination_type_to_standa,questions/combo_type_norm__row_158__In_Non_Small_Cell_Lung_combination_therapy_trials_normalize_the_combination_type_to_standa/ground_truth_table.csv
row_160,160,"In Colorectal trials, normalize the clinical setting to one of: neoadjuvant, adjuvant, perioperative, metastatic/advanced.","[""setting_normalized""]",ok,,questions/setting_normalized__row_160__In_Colorectal_trials_normalize_the_clinical_setting_to_one_of_neoadjuvant_adjuvant_periope,questions/setting_normalized__row_160__In_Colorectal_trials_normalize_the_clinical_setting_to_one_of_neoadjuvant_adjuvant_periope/ground_truth_table.csv
row_161,161,"In Renal cell trials, categorize number of arms as 1-arm, 2-arm, or ≥3-arm.","[""arm_category""]",ok,,questions/arm_category__row_161__In_Renal_cell_trials_categorize_number_of_arms_as_1_arm_2_arm_or_3_arm,questions/arm_category__row_161__In_Renal_cell_trials_categorize_number_of_arms_as_1_arm_2_arm_or_3_arm/ground_truth_table.csv
row_162,162,"For Brentuximab-vedotin trials, bucket total sample size as small(<100), medium(100–299), or large(≥300).","[""size_bucket""]",ok,,questions/size_bucket__row_162__For_Brentuximab_vedotin_trials_bucket_total_sample_size_as_small_100_medium_100_299_or_lar,questions/size_bucket__row_162__For_Brentuximab_vedotin_trials_bucket_total_sample_size_as_small_100_medium_100_299_or_lar/ground_truth_table.csv
row_163,163,"In Melanoma trials, classify overall follow-up maturity: 'mature' if ≥24 months, else 'immature' (or 'unknown' if missing).","[""maturity""]",ok,,questions/maturity__row_163__In_Melanoma_trials_classify_overall_follow_up_maturity_mature_if_24_months_else_immature_o,questions/maturity__row_163__In_Melanoma_trials_classify_overall_follow_up_maturity_mature_if_24_months_else_immature_o/ground_truth_table.csv
row_164,164,"For Pembrolizumab trials in Head and Neck, extract the trial acronym from the trial name (e.g., KEYNOTE-xxx, CHECKMATE-xxx).","[""trial_acronym""]",ok,,questions/trial_acronym__row_164__For_Pembrolizumab_trials_in_Head_and_Neck_extract_the_trial_acronym_from_the_trial_name_e,questions/trial_acronym__row_164__For_Pembrolizumab_trials_in_Head_and_Neck_extract_the_trial_acronym_from_the_trial_name_e/ground_truth_table.csv
row_165,165,"In Small Cell Lung trials, normalize the clinical setting to one of: neoadjuvant, adjuvant, perioperative, metastatic/advanced.","[""setting_normalized""]",ok,,questions/setting_normalized__row_165__In_Small_Cell_Lung_trials_normalize_the_clinical_setting_to_one_of_neoadjuvant_adjuvant_pe,questions/setting_normalized__row_165__In_Small_Cell_Lung_trials_normalize_the_clinical_setting_to_one_of_neoadjuvant_adjuvant_pe/ground_truth_table.csv
row_168,168,"For Atezolizumab+Trastuzumab emtansine+Placebo trials in Non-Small Cell Lung, extract the trial acronym from the trial name (e.g., KEYNOTE-xxx, CHECKMATE-xxx).","[""trial_acronym""]",ok,,questions/trial_acronym__row_168__For_Atezolizumab_Trastuzumab_emtansine_Placebo_trials_in_Non_Small_Cell_Lung_extract_the_t,questions/trial_acronym__row_168__For_Atezolizumab_Trastuzumab_emtansine_Placebo_trials_in_Non_Small_Cell_Lung_extract_the_t/ground_truth_table.csv
row_170,170,"For Pembrolizumab combination therapy trials, list additional agents in the treatment regimen beyond the ICI.","[""added_agents""]",ok,,questions/added_agents__row_170__For_Pembrolizumab_combination_therapy_trials_list_additional_agents_in_the_treatment_regim,questions/added_agents__row_170__For_Pembrolizumab_combination_therapy_trials_list_additional_agents_in_the_treatment_regim/ground_truth_table.csv
row_171,171,"For Ipilimumab trials, bucket trial phase into early (1/1b/2) vs late (3/4).","[""phase_bucket""]",ok,,questions/phase_bucket__row_171__For_Ipilimumab_trials_bucket_trial_phase_into_early_1_1b_2_vs_late_3_4,questions/phase_bucket__row_171__For_Ipilimumab_trials_bucket_trial_phase_into_early_1_1b_2_vs_late_3_4/ground_truth_table.csv
row_172,172,"In Non-Small Cell Lung trials with chemotherapy control, list the specific cytotoxic drugs from the control regimen.","[""control_drugs""]",ok,,questions/control_drugs__row_172__In_Non_Small_Cell_Lung_trials_with_chemotherapy_control_list_the_specific_cytotoxic_drugs,questions/control_drugs__row_172__In_Non_Small_Cell_Lung_trials_with_chemotherapy_control_list_the_specific_cytotoxic_drugs/ground_truth_table.csv
row_173,173,"For Durvalumab trials, bucket trial phase into early (1/1b/2) vs late (3/4).","[""phase_bucket""]",ok,,questions/phase_bucket__row_173__For_Durvalumab_trials_bucket_trial_phase_into_early_1_1b_2_vs_late_3_4,questions/phase_bucket__row_173__For_Durvalumab_trials_bucket_trial_phase_into_early_1_1b_2_vs_late_3_4/ground_truth_table.csv
row_175,175,"In Pancreatic trials, interpret the PD-L1 requirement flag as boolean true/false.","[""pd_l1_required""]",ok,,questions/pd_l1_required__row_175__In_Pancreatic_trials_interpret_the_PD_L1_requirement_flag_as_boolean_true_false,questions/pd_l1_required__row_175__In_Pancreatic_trials_interpret_the_PD_L1_requirement_flag_as_boolean_true_false/ground_truth_table.csv
row_176,176,"In Urothelial trials, classify overall follow-up maturity: 'mature' if ≥24 months, else 'immature' (or 'unknown' if missing).","[""maturity""]",ok,,questions/maturity__row_176__In_Urothelial_trials_classify_overall_follow_up_maturity_mature_if_24_months_else_immature,questions/maturity__row_176__In_Urothelial_trials_classify_overall_follow_up_maturity_mature_if_24_months_else_immature/ground_truth_table.csv
row_179,179,"In Gastric/GEJ trials, determine whether the listed endpoint is primary or secondary based on the endpoint text.","[""endpoint_role""]",ok,,questions/endpoint_role__row_179__In_Gastric_GEJ_trials_determine_whether_the_listed_endpoint_is_primary_or_secondary_based,questions/endpoint_role__row_179__In_Gastric_GEJ_trials_determine_whether_the_listed_endpoint_is_primary_or_secondary_based/ground_truth_table.csv
row_180,180,"In Mesothelioma trials, convert 'Type of therapy' into is_combination = true/false.","[""is_combination""]",ok,,questions/is_combination__row_180__In_Mesothelioma_trials_convert_Type_of_therapy_into_is_combination_true_false,questions/is_combination__row_180__In_Mesothelioma_trials_convert_Type_of_therapy_into_is_combination_true_false/ground_truth_table.csv
row_182,182,"In Hodgkin Lymphoma trials, classify the ICI by target class from its generic name as PD-1, PD-L1, or CTLA-4.","[""class""]",ok,,questions/class__row_182__In_Hodgkin_Lymphoma_trials_classify_the_ICI_by_target_class_from_its_generic_name_as_PD_1,questions/class__row_182__In_Hodgkin_Lymphoma_trials_classify_the_ICI_by_target_class_from_its_generic_name_as_PD_1/ground_truth_table.csv
row_185,185,"In Breast trials, categorize number of arms as 1-arm, 2-arm, or ≥3-arm.","[""arm_category""]",ok,,questions/arm_category__row_185__In_Breast_trials_categorize_number_of_arms_as_1_arm_2_arm_or_3_arm,questions/arm_category__row_185__In_Breast_trials_categorize_number_of_arms_as_1_arm_2_arm_or_3_arm/ground_truth_table.csv
row_186,186,"In Hepatocellular trials, from the secondary endpoint text flag if immune-related adverse events (irAEs) were explicitly assessed.","[""irAE_assessed""]",ok,,questions/irAE_assessed__row_186__In_Hepatocellular_trials_from_the_secondary_endpoint_text_flag_if_immune_related_adverse_e,questions/irAE_assessed__row_186__In_Hepatocellular_trials_from_the_secondary_endpoint_text_flag_if_immune_related_adverse_e/ground_truth_table.csv
row_187,187,"In Colorectal combination therapy trials, normalize the combination type to standardized labels (e.g., ICI+Chemo, ICI+TKI, ICI+ICI).","[""combo_type_norm""]",ok,,questions/combo_type_norm__row_187__In_Colorectal_combination_therapy_trials_normalize_the_combination_type_to_standardized_la,questions/combo_type_norm__row_187__In_Colorectal_combination_therapy_trials_normalize_the_combination_type_to_standardized_la/ground_truth_table.csv
row_189,189,"In Multiple Myeloma trials, categorize number of arms as 1-arm, 2-arm, or ≥3-arm.","[""arm_category""]",ok,,questions/arm_category__row_189__In_Multiple_Myeloma_trials_categorize_number_of_arms_as_1_arm_2_arm_or_3_arm,questions/arm_category__row_189__In_Multiple_Myeloma_trials_categorize_number_of_arms_as_1_arm_2_arm_or_3_arm/ground_truth_table.csv
row_191,191,"For Brentuximab-vedotin trials, bucket the publication year into: ≤2014, 2015–2018, ≥2019.","[""era""]",ok,,questions/era__row_191__For_Brentuximab_vedotin_trials_bucket_the_publication_year_into_2014_2015_2018_2019,questions/era__row_191__For_Brentuximab_vedotin_trials_bucket_the_publication_year_into_2014_2015_2018_2019/ground_truth_table.csv
row_193,193,"In Hepatocellular trials, normalize the clinical setting to one of: neoadjuvant, adjuvant, perioperative, metastatic/advanced.","[""setting_normalized""]",ok,,questions/setting_normalized__row_193__In_Hepatocellular_trials_normalize_the_clinical_setting_to_one_of_neoadjuvant_adjuvant_per,questions/setting_normalized__row_193__In_Hepatocellular_trials_normalize_the_clinical_setting_to_one_of_neoadjuvant_adjuvant_per/ground_truth_table.csv
row_195,195,"For Atezolizumab trials in Breast, extract the trial acronym from the trial name (e.g., KEYNOTE-xxx, CHECKMATE-xxx).","[""trial_acronym""]",ok,,questions/trial_acronym__row_195__For_Atezolizumab_trials_in_Breast_extract_the_trial_acronym_from_the_trial_name_e_g_KEYNOT,questions/trial_acronym__row_195__For_Atezolizumab_trials_in_Breast_extract_the_trial_acronym_from_the_trial_name_e_g_KEYNOT/ground_truth_table.csv
row_196,196,"For Chemotherapy combination therapy trials, list additional agents in the treatment regimen beyond the ICI.","[""added_agents""]",ok,,questions/added_agents__row_196__For_Chemotherapy_combination_therapy_trials_list_additional_agents_in_the_treatment_regime,questions/added_agents__row_196__For_Chemotherapy_combination_therapy_trials_list_additional_agents_in_the_treatment_regime/ground_truth_table.csv
row_197,197,"For Durvalumab combination therapy trials, list additional agents in the treatment regimen beyond the ICI.","[""added_agents""]",ok,,questions/added_agents__row_197__For_Durvalumab_combination_therapy_trials_list_additional_agents_in_the_treatment_regimen,questions/added_agents__row_197__For_Durvalumab_combination_therapy_trials_list_additional_agents_in_the_treatment_regimen/ground_truth_table.csv
row_198,198,"In NSCLC trials, interpret the PD-L1 requirement flag as boolean true/false.","[""pd_l1_required""]",ok,,questions/pd_l1_required__row_198__In_NSCLC_trials_interpret_the_PD_L1_requirement_flag_as_boolean_true_false,questions/pd_l1_required__row_198__In_NSCLC_trials_interpret_the_PD_L1_requirement_flag_as_boolean_true_false/ground_truth_table.csv
row_200,200,"In Multiple Myeloma trials with chemotherapy control, list the specific cytotoxic drugs from the control regimen.","[""control_drugs""]",ok,,questions/control_drugs__row_200__In_Multiple_Myeloma_trials_with_chemotherapy_control_list_the_specific_cytotoxic_drugs_fro,questions/control_drugs__row_200__In_Multiple_Myeloma_trials_with_chemotherapy_control_list_the_specific_cytotoxic_drugs_fro/ground_truth_table.csv
row_201,201,"In Renal cell Phase 3 trials, standardize the primary endpoint into one of OS, PFS, ORR, DFS, DOR, AE-rate, or Other.","[""primary_endpoint_category""]",ok,,questions/primary_endpoint_category__row_201__In_Renal_cell_Phase_3_trials_standardize_the_primary_endpoint_into_one_of_OS_PFS_ORR_DFS_D,questions/primary_endpoint_category__row_201__In_Renal_cell_Phase_3_trials_standardize_the_primary_endpoint_into_one_of_OS_PFS_ORR_DFS_D/ground_truth_table.csv
row_203,203,"In Prostate trials, normalize the clinical setting to one of: neoadjuvant, adjuvant, perioperative, metastatic/advanced.","[""setting_normalized""]",ok,,questions/setting_normalized__row_203__In_Prostate_trials_normalize_the_clinical_setting_to_one_of_neoadjuvant_adjuvant_periopera,questions/setting_normalized__row_203__In_Prostate_trials_normalize_the_clinical_setting_to_one_of_neoadjuvant_adjuvant_periopera/ground_truth_table.csv
row_204,204,"In Prostate trials, convert 'Original/Follow up' status into a boolean is_follow_up.","[""is_follow_up""]",ok,,questions/is_follow_up__row_204__In_Prostate_trials_convert_Original_Follow_up_status_into_a_boolean_is_follow_up,questions/is_follow_up__row_204__In_Prostate_trials_convert_Original_Follow_up_status_into_a_boolean_is_follow_up/ground_truth_table.csv
row_205,205,"In Urothelial trials, convert 'Type of therapy' into is_combination = true/false.","[""is_combination""]",ok,,questions/is_combination__row_205__In_Urothelial_trials_convert_Type_of_therapy_into_is_combination_true_false,questions/is_combination__row_205__In_Urothelial_trials_convert_Type_of_therapy_into_is_combination_true_false/ground_truth_table.csv
row_206,206,"For Durvalumab, Tremelimumab trials in Hepatocellular, extract the trial acronym from the trial name (e.g., KEYNOTE-xxx, CHECKMATE-xxx).","[""trial_acronym""]",ok,,questions/trial_acronym__row_206__For_Durvalumab_Tremelimumab_trials_in_Hepatocellular_extract_the_trial_acronym_from_the_tr,questions/trial_acronym__row_206__For_Durvalumab_Tremelimumab_trials_in_Hepatocellular_extract_the_trial_acronym_from_the_tr/ground_truth_table.csv
row_207,207,"In Melanoma trials with chemotherapy control, list the specific cytotoxic drugs from the control regimen.","[""control_drugs""]",ok,,questions/control_drugs__row_207__In_Melanoma_trials_with_chemotherapy_control_list_the_specific_cytotoxic_drugs_from_the_co,questions/control_drugs__row_207__In_Melanoma_trials_with_chemotherapy_control_list_the_specific_cytotoxic_drugs_from_the_co/ground_truth_table.csv
row_209,209,"In Prostate trials, from the secondary endpoint text flag if immune-related adverse events (irAEs) were explicitly assessed.","[""irAE_assessed""]",ok,,questions/irAE_assessed__row_209__In_Prostate_trials_from_the_secondary_endpoint_text_flag_if_immune_related_adverse_events,questions/irAE_assessed__row_209__In_Prostate_trials_from_the_secondary_endpoint_text_flag_if_immune_related_adverse_events/ground_truth_table.csv
row_210,210,"In Gastric/GEJ trials, normalize the clinical setting to one of: neoadjuvant, adjuvant, perioperative, metastatic/advanced.","[""setting_normalized""]",ok,,questions/setting_normalized__row_210__In_Gastric_GEJ_trials_normalize_the_clinical_setting_to_one_of_neoadjuvant_adjuvant_periop,questions/setting_normalized__row_210__In_Gastric_GEJ_trials_normalize_the_clinical_setting_to_one_of_neoadjuvant_adjuvant_periop/ground_truth_table.csv
row_211,211,"In Urothelial studies using ICI+TKI, list the TKI agent(s) mentioned in the treatment regimen.","[""tki_agents""]",ok,,questions/tki_agents__row_211__In_Urothelial_studies_using_ICI_TKI_list_the_TKI_agent_s_mentioned_in_the_treatment_regime,questions/tki_agents__row_211__In_Urothelial_studies_using_ICI_TKI_list_the_TKI_agent_s_mentioned_in_the_treatment_regime/ground_truth_table.csv
row_213,213,"In Renal cell trials, classify the ICI by target class from its generic name as PD-1, PD-L1, or CTLA-4.","[""class""]",ok,,questions/class__row_213__In_Renal_cell_trials_classify_the_ICI_by_target_class_from_its_generic_name_as_PD_1_PD_L1,questions/class__row_213__In_Renal_cell_trials_classify_the_ICI_by_target_class_from_its_generic_name_as_PD_1_PD_L1/ground_truth_table.csv
row_215,215,"In Colorectal trials, convert 'Type of therapy' into is_combination = true/false.","[""is_combination""]",ok,,questions/is_combination__row_215__In_Colorectal_trials_convert_Type_of_therapy_into_is_combination_true_false,questions/is_combination__row_215__In_Colorectal_trials_convert_Type_of_therapy_into_is_combination_true_false/ground_truth_table.csv
row_216,216,"In Bladder trials, interpret the PD-L1 requirement flag as boolean true/false.","[""pd_l1_required""]",ok,,questions/pd_l1_required__row_216__In_Bladder_trials_interpret_the_PD_L1_requirement_flag_as_boolean_true_false,questions/pd_l1_required__row_216__In_Bladder_trials_interpret_the_PD_L1_requirement_flag_as_boolean_true_false/ground_truth_table.csv
row_217,217,"In Breast trials, interpret the PD-L1 requirement flag as boolean true/false.","[""pd_l1_required""]",ok,,questions/pd_l1_required__row_217__In_Breast_trials_interpret_the_PD_L1_requirement_flag_as_boolean_true_false,questions/pd_l1_required__row_217__In_Breast_trials_interpret_the_PD_L1_requirement_flag_as_boolean_true_false/ground_truth_table.csv
row_218,218,"In Colorectal trials, classify the ICI by target class from its generic name as PD-1, PD-L1, or CTLA-4.","[""class""]",ok,,questions/class__row_218__In_Colorectal_trials_classify_the_ICI_by_target_class_from_its_generic_name_as_PD_1_PD_L1,questions/class__row_218__In_Colorectal_trials_classify_the_ICI_by_target_class_from_its_generic_name_as_PD_1_PD_L1/ground_truth_table.csv
row_219,219,"In Esophageal/GEJ studies using ICI+TKI, list the TKI agent(s) mentioned in the treatment regimen.","[""tki_agents""]",ok,,questions/tki_agents__row_219__In_Esophageal_GEJ_studies_using_ICI_TKI_list_the_TKI_agent_s_mentioned_in_the_treatment_re,questions/tki_agents__row_219__In_Esophageal_GEJ_studies_using_ICI_TKI_list_the_TKI_agent_s_mentioned_in_the_treatment_re/ground_truth_table.csv
row_220,220,"For Durvalumab trials, bucket total sample size as small(<100), medium(100–299), or large(≥300).","[""size_bucket""]",ok,,questions/size_bucket__row_220__For_Durvalumab_trials_bucket_total_sample_size_as_small_100_medium_100_299_or_large_300,questions/size_bucket__row_220__For_Durvalumab_trials_bucket_total_sample_size_as_small_100_medium_100_299_or_large_300/ground_truth_table.csv
row_221,221,"In Mesothelioma Phase 2 trials, standardize the primary endpoint into one of OS, PFS, ORR, DFS, DOR, AE-rate, or Other.","[""primary_endpoint_category""]",ok,,questions/primary_endpoint_category__row_221__In_Mesothelioma_Phase_2_trials_standardize_the_primary_endpoint_into_one_of_OS_PFS_ORR_DFS,questions/primary_endpoint_category__row_221__In_Mesothelioma_Phase_2_trials_standardize_the_primary_endpoint_into_one_of_OS_PFS_ORR_DFS/ground_truth_table.csv
row_223,223,"For Nivolumab trials, bucket total sample size as small(<100), medium(100–299), or large(≥300).","[""size_bucket""]",ok,,questions/size_bucket__row_223__For_Nivolumab_trials_bucket_total_sample_size_as_small_100_medium_100_299_or_large_300,questions/size_bucket__row_223__For_Nivolumab_trials_bucket_total_sample_size_as_small_100_medium_100_299_or_large_300/ground_truth_table.csv
row_224,224,"For Durvalumab trials, bucket the publication year into: ≤2014, 2015–2018, ≥2019.","[""era""]",ok,,questions/era__row_224__For_Durvalumab_trials_bucket_the_publication_year_into_2014_2015_2018_2019,questions/era__row_224__For_Durvalumab_trials_bucket_the_publication_year_into_2014_2015_2018_2019/ground_truth_table.csv
row_225,225,"For Atezolizumab+Trastuzumab emtansine+Placebo trials in Small Cell Lung, extract the trial acronym from the trial name (e.g., KEYNOTE-xxx, CHECKMATE-xxx).","[""trial_acronym""]",ok,,questions/trial_acronym__row_225__For_Atezolizumab_Trastuzumab_emtansine_Placebo_trials_in_Small_Cell_Lung_extract_the_trial,questions/trial_acronym__row_225__For_Atezolizumab_Trastuzumab_emtansine_Placebo_trials_in_Small_Cell_Lung_extract_the_trial/ground_truth_table.csv
row_227,227,"In Hepatocellular Phase 2 trials, standardize the primary endpoint into one of OS, PFS, ORR, DFS, DOR, AE-rate, or Other.","[""primary_endpoint_category""]",ok,,questions/primary_endpoint_category__row_227__In_Hepatocellular_Phase_2_trials_standardize_the_primary_endpoint_into_one_of_OS_PFS_ORR_D,questions/primary_endpoint_category__row_227__In_Hepatocellular_Phase_2_trials_standardize_the_primary_endpoint_into_one_of_OS_PFS_ORR_D/ground_truth_table.csv
row_228,228,"In Breast trials, classify the ICI by target class from its generic name as PD-1, PD-L1, or CTLA-4.","[""class""]",ok,,questions/class__row_228__In_Breast_trials_classify_the_ICI_by_target_class_from_its_generic_name_as_PD_1_PD_L1_or_C,questions/class__row_228__In_Breast_trials_classify_the_ICI_by_target_class_from_its_generic_name_as_PD_1_PD_L1_or_C/ground_truth_table.csv
row_229,229,"In Gastric/GEJ trials, categorize number of arms as 1-arm, 2-arm, or ≥3-arm.","[""arm_category""]",ok,,questions/arm_category__row_229__In_Gastric_GEJ_trials_categorize_number_of_arms_as_1_arm_2_arm_or_3_arm,questions/arm_category__row_229__In_Gastric_GEJ_trials_categorize_number_of_arms_as_1_arm_2_arm_or_3_arm/ground_truth_table.csv
row_230,230,"In Gastric/GEJ trials, classify overall follow-up maturity: 'mature' if ≥24 months, else 'immature' (or 'unknown' if missing).","[""maturity""]",ok,,questions/maturity__row_230__In_Gastric_GEJ_trials_classify_overall_follow_up_maturity_mature_if_24_months_else_immatur,questions/maturity__row_230__In_Gastric_GEJ_trials_classify_overall_follow_up_maturity_mature_if_24_months_else_immatur/ground_truth_table.csv
row_232,232,"In Esophageal/GEJ trials, interpret the PD-L1 requirement flag as boolean true/false.","[""pd_l1_required""]",ok,,questions/pd_l1_required__row_232__In_Esophageal_GEJ_trials_interpret_the_PD_L1_requirement_flag_as_boolean_true_false,questions/pd_l1_required__row_232__In_Esophageal_GEJ_trials_interpret_the_PD_L1_requirement_flag_as_boolean_true_false/ground_truth_table.csv
row_233,233,"In Melanoma trials, convert 'Type of therapy' into is_combination = true/false.","[""is_combination""]",ok,,questions/is_combination__row_233__In_Melanoma_trials_convert_Type_of_therapy_into_is_combination_true_false,questions/is_combination__row_233__In_Melanoma_trials_convert_Type_of_therapy_into_is_combination_true_false/ground_truth_table.csv
row_236,236,"In Multiple Myeloma combination therapy trials, normalize the combination type to standardized labels (e.g., ICI+Chemo, ICI+TKI, ICI+ICI).","[""combo_type_norm""]",ok,,questions/combo_type_norm__row_236__In_Multiple_Myeloma_combination_therapy_trials_normalize_the_combination_type_to_standardi,questions/combo_type_norm__row_236__In_Multiple_Myeloma_combination_therapy_trials_normalize_the_combination_type_to_standardi/ground_truth_table.csv
row_237,237,"In Renal cell Phase 2 trials, standardize the primary endpoint into one of OS, PFS, ORR, DFS, DOR, AE-rate, or Other.","[""primary_endpoint_category""]",ok,,questions/primary_endpoint_category__row_237__In_Renal_cell_Phase_2_trials_standardize_the_primary_endpoint_into_one_of_OS_PFS_ORR_DFS_D,questions/primary_endpoint_category__row_237__In_Renal_cell_Phase_2_trials_standardize_the_primary_endpoint_into_one_of_OS_PFS_ORR_DFS_D/ground_truth_table.csv
row_238,238,"In Breast combination therapy trials, normalize the combination type to standardized labels (e.g., ICI+Chemo, ICI+TKI, ICI+ICI).","[""combo_type_norm""]",ok,,questions/combo_type_norm__row_238__In_Breast_combination_therapy_trials_normalize_the_combination_type_to_standardized_labels,questions/combo_type_norm__row_238__In_Breast_combination_therapy_trials_normalize_the_combination_type_to_standardized_labels/ground_truth_table.csv
row_239,239,"In Hodgkin Lymphoma studies using ICI+TKI, list the TKI agent(s) mentioned in the treatment regimen.","[""tki_agents""]",ok,,questions/tki_agents__row_239__In_Hodgkin_Lymphoma_studies_using_ICI_TKI_list_the_TKI_agent_s_mentioned_in_the_treatment,questions/tki_agents__row_239__In_Hodgkin_Lymphoma_studies_using_ICI_TKI_list_the_TKI_agent_s_mentioned_in_the_treatment/ground_truth_table.csv
row_241,241,"In Multiple Myeloma Phase 2 trials, standardize the primary endpoint into one of OS, PFS, ORR, DFS, DOR, AE-rate, or Other.","[""primary_endpoint_category""]",ok,,questions/primary_endpoint_category__row_241__In_Multiple_Myeloma_Phase_2_trials_standardize_the_primary_endpoint_into_one_of_OS_PFS_ORR,questions/primary_endpoint_category__row_241__In_Multiple_Myeloma_Phase_2_trials_standardize_the_primary_endpoint_into_one_of_OS_PFS_ORR/ground_truth_table.csv
row_242,242,"In Head and Neck trials, classify the ICI by target class from its generic name as PD-1, PD-L1, or CTLA-4.","[""class""]",ok,,questions/class__row_242__In_Head_and_Neck_trials_classify_the_ICI_by_target_class_from_its_generic_name_as_PD_1_PD,questions/class__row_242__In_Head_and_Neck_trials_classify_the_ICI_by_target_class_from_its_generic_name_as_PD_1_PD/ground_truth_table.csv
row_244,244,"In Multiple Myeloma trials, classify overall follow-up maturity: 'mature' if ≥24 months, else 'immature' (or 'unknown' if missing).","[""maturity""]",ok,,questions/maturity__row_244__In_Multiple_Myeloma_trials_classify_overall_follow_up_maturity_mature_if_24_months_else_im,questions/maturity__row_244__In_Multiple_Myeloma_trials_classify_overall_follow_up_maturity_mature_if_24_months_else_im/ground_truth_table.csv
row_245,245,"In Prostate Phase 3 trials, classify the control arm as active, placebo, or best supportive care.","[""control_category""]",ok,,questions/control_category__row_245__In_Prostate_Phase_3_trials_classify_the_control_arm_as_active_placebo_or_best_supportive_c,questions/control_category__row_245__In_Prostate_Phase_3_trials_classify_the_control_arm_as_active_placebo_or_best_supportive_c/ground_truth_table.csv
